DS,What,chr,GO,NS,enrichment,name,ratio_in_study,ratio_in_pop,p_uncorrected,depth,study_count,p_fdr_bh,study_items
Tissue pcHi-C,Links w/ 5+ tissues vs Links w/ 1+ tissue,chr2,GO:1901363,MF,e,heterocyclic compound binding ,358/1133,361/1188,6.83e-06,2,358,0.00165,"AAK1, ABCA12, ABCB11, ABCB6, ABCG5, ABCG8, ABI2, AC012493.2, ACADL, ACOXL, ACSL3, ACTG2, ACTR1B, ACTR2, ACTR3, ACVR1, ACVR1C, ACVR2A, ADCY3, AFF3, AGAP1, AGFG1, AGPS, AGXT, ALK, AOX1, APLF, ARID5A, ARL4C, ARL5A, ASXL2, ATAD2B, ATF2, ATL2, ATOH8, ATP6V1B1, BARD1, BAZ2B, BCL11A, BCS1L, BMPR2, BOLL, BUB1, C1D, CAD, CARF, CCDC141, CCT4, CCT7, CDK15, CDKL4, CEBPZ, CENPA, CERS6, CIR1, CLK1, CMPK2, CNGA3, CNNM3, CNNM4, CPS1, CPSF3, CREB1, CREG2, CSRNP3, CWC22, CYP1B1, CYP20A1, CYP26B1, CYP27A1, CYP27C1, D2HGDH, DARS, DBI, DDX1, DDX18, DGKD, DGUOK, DHX57, DIS3L2, DLX1, DLX2, DNAH6, DNAH7, DNAJC27, DNMT3A, DQX1, DTYMK, DUSP11, E2F6, EEF1B2, EGR4, EHD3, EIF2AK2, EIF2AK3, EIF2B4, EIF4E2, EIF5B, EMX1, EN1, EPAS1, EPHA4, ERBB4, ERCC3, EVX2, FAM171B, FARSB, FEV, FIGLA, FIGN, FKBP1B, FKBP7, FOSL2, FOXN2, FTCDNL1, GAD1, GBX2, GCC2, GCFC2, GEN1, GLI2, GMPPA, GPATCH11, GPN1, GRHL1, GTF2A1L, GTF3C2, GTF3C3, HADHA, HADHB, HDAC4, HDLBP, HES6, HJURP, HK2, HNRNPA3, HNRNPLL, HOXD1, HOXD10, HOXD11, HOXD12, HOXD13, HOXD3, HOXD4, HOXD8, HOXD9, HSPD1, HSPE1, HSPE1-MOB4, HTR2B, IDH1, IFIH1, IKZF2, IQCA1, ITM2C, IWS1, KCNIP3, KDM3A, KHK, KIAA1841, KIF1A, KIF3C, KIF5C, KLF11, KLF7, KYNU, LBX2, LRPPRC, LRRFIP1, MAP3K19, MAP3K2, MAP4K3, MAP4K4, MARS2, MAT2A, MBD5, MCM6, MDH1, MEIS1, MERTK, METTL5, MLTK, MRPS5, MSGN1, MSH2, MSH6, MTA3, MTERFD2, MTIF2, MXD1, MYCN, MYO1B, MYO3B, MYO7B, MYT1L, NABP1, NAGK, NCL, NCOA1, NDUFA10, NEUROD1, NFE2L2, NHEJ1, NIF3L1, NIFK, NLRC4, NOP58, NOSTRIN, NOTO, NPAS2, NR4A2, NRBP1, NT5C1B, NT5C1B-RDH14, OLA1, ORC2, ORC4, OSR1, OTX1, PAIP2B, PAPOLG, PASK, PAX3, PAX8, PCBP1, PDE11A, PDE1A, PDK1, PIKFYVE, PKDCC, PMS1, PNO1, PNPT1, POLE4, POLR1A, POLR1B, POLR2D, POU3F3, PREB, PRKAG3, PRKCE, PRKD3, PRKRA, PTCD3, PUM2, PUS10, PXDN, R3HDM1, RAB10, RAB17, RAB1A, RAB6C, RABL2A, RALB, RANBP2, RAPGEF4, RBKS, RBM43, RBM44, RBM45, RBMS1, REL, REV1, RFX8, RHOB, RHOQ, RNASEH1, RND3, ROCK2, RP13-512J5.1, RPL31, RPS7, RTKN, SATB2, SCLY, SEPT10, SEPT2, SF3B14, SIX2, SIX3, SMARCAL1, SMC6, SMYD1, SNRNP200, SNRNP27, SNRPG, SOS1, SOX11, SP100, SP110, SP140, SP140L, SP3, SP5, SP9, SPAST, SPEG, SPR, SRBD1, SRSF7, SSB, STAT1, STAT4, STK16, STK17B, STK25, STK36, STK39, STRADB, SUCLG1, TAF1B, TBR1, TCF7L1, TDRD15, TFCP2L1, THAP4, THNSL2, THUMPD2, TIA1, TIGD1, TLK1, TLX2, TMEM18, TNP1, TP53I3, TPO, TRIB2, TSN, TTL, TTN, TUBA3D, TUBA3E, TUBA4A, TWIST2, TYW5, UBE2E3, UBE2F, UGP2, UNC50, VAX2, VRK2, WDSUB1, XDH, XPO1, XRCC5, ZAP70, ZC3H8, ZDBF2, ZEB2, ZFP36L2, ZNF142, ZNF2, ZNF385B, ZNF512, ZNF513, ZNF514, ZNF638, ZRANB3"
Tissue pcHi-C,Links w/ 5+ tissues vs Links w/ 1+ tissue,chr2,GO:0097159,MF,e,organic cyclic compound binding,361/1133,364/1188,6.95e-06,2,361,0.00165,"AAK1, ABCA12, ABCB11, ABCB6, ABCG5, ABCG8, ABI2, AC012493.2, ACADL, ACOXL, ACSL3, ACTG2, ACTR1B, ACTR2, ACTR3, ACVR1, ACVR1C, ACVR2A, ADCY3, ADRA2B, AFF3, AGAP1, AGFG1, AGPS, AGXT, ALK, AOX1, APLF, ARID5A, ARL4C, ARL5A, ASXL2, ATAD2B, ATF2, ATL2, ATOH8, ATP6V1B1, BARD1, BAZ2B, BCL11A, BCS1L, BMPR2, BOLL, BUB1, C1D, CAD, CARF, CCDC141, CCT4, CCT7, CDK15, CDKL4, CEBPZ, CENPA, CERS6, CIR1, CLK1, CMPK2, CNGA3, CNNM3, CNNM4, CPS1, CPSF3, CREB1, CREG2, CSRNP3, CWC22, CYP1B1, CYP20A1, CYP26B1, CYP27A1, CYP27C1, D2HGDH, DARS, DBI, DDX1, DDX18, DGKD, DGUOK, DHX57, DIS3L2, DLX1, DLX2, DNAH6, DNAH7, DNAJC27, DNMT3A, DQX1, DTYMK, DUSP11, E2F6, EEF1B2, EGR4, EHD3, EIF2AK2, EIF2AK3, EIF2B4, EIF4E2, EIF5B, EMX1, EN1, EPAS1, EPHA4, ERBB4, ERCC3, EVX2, FAM171B, FARSB, FEV, FIGLA, FIGN, FKBP1B, FKBP7, FOSL2, FOXN2, FTCDNL1, GAD1, GBX2, GCC2, GCFC2, GEN1, GLI2, GMPPA, GPATCH11, GPN1, GRHL1, GTF2A1L, GTF3C2, GTF3C3, HADHA, HADHB, HDAC4, HDLBP, HES6, HJURP, HK2, HNRNPA3, HNRNPLL, HOXD1, HOXD10, HOXD11, HOXD12, HOXD13, HOXD3, HOXD4, HOXD8, HOXD9, HSPD1, HSPE1, HSPE1-MOB4, HTR2B, IDH1, IFIH1, IKZF2, IQCA1, ITM2C, IWS1, KCNIP3, KDM3A, KHK, KIAA1841, KIF1A, KIF3C, KIF5C, KLF11, KLF7, KYNU, LBX2, LRPPRC, LRRFIP1, MAP3K19, MAP3K2, MAP4K3, MAP4K4, MARS2, MAT2A, MBD5, MCM6, MDH1, MEIS1, MERTK, METTL5, MLTK, MRPS5, MSGN1, MSH2, MSH6, MTA3, MTERFD2, MTIF2, MXD1, MYCN, MYO1B, MYO3B, MYO7B, MYT1L, NABP1, NAGK, NCL, NCOA1, NDUFA10, NEUROD1, NFE2L2, NHEJ1, NIF3L1, NIFK, NLRC4, NOP58, NOSTRIN, NOTO, NPAS2, NR4A2, NRBP1, NT5C1B, NT5C1B-RDH14, OLA1, ORC2, ORC4, OSR1, OTX1, PAIP2B, PAPOLG, PASK, PAX3, PAX8, PCBP1, PDE11A, PDE1A, PDK1, PIKFYVE, PKDCC, PMS1, PNO1, PNPT1, POLE4, POLR1A, POLR1B, POLR2D, POU3F3, PREB, PRKAG3, PRKCE, PRKD3, PRKRA, PTCD3, PUM2, PUS10, PXDN, R3HDM1, RAB10, RAB17, RAB1A, RAB6C, RABL2A, RALB, RANBP2, RAPGEF4, RBKS, RBM43, RBM44, RBM45, RBMS1, REL, REV1, RFX8, RHOB, RHOQ, RNASEH1, RND3, ROCK2, RP13-512J5.1, RPL31, RPS7, RTKN, SATB2, SCLY, SEPT10, SEPT2, SF3B14, SIX2, SIX3, SMARCAL1, SMC6, SMYD1, SNRNP200, SNRNP27, SNRPG, SOS1, SOX11, SP100, SP110, SP140, SP140L, SP3, SP5, SP9, SPAST, SPEG, SPR, SRBD1, SRSF7, SSB, STAT1, STAT4, STK16, STK17B, STK25, STK36, STK39, STRADB, SUCLG1, TAF1B, TBR1, TCF7L1, TDRD15, TFCP2L1, THAP4, THNSL2, THUMPD2, TIA1, TIGD1, TLK1, TLX2, TMEM18, TNP1, TP53I3, TPO, TRIB2, TSN, TTL, TTN, TUBA3D, TUBA3E, TUBA4A, TWIST2, TYW5, UBE2E3, UBE2F, UGP2, UGT1A1, UGT1A8, UNC50, VAX2, VRK2, WDSUB1, XDH, XPO1, XRCC5, ZAP70, ZC3H8, ZDBF2, ZEB2, ZFP36L2, ZNF142, ZNF2, ZNF385B, ZNF512, ZNF513, ZNF514, ZNF638, ZRANB3"
Tissue pcHi-C,Links w/ 5+ tissues vs Links w/ 1+ tissue,chr2,GO:0003824,MF,e,catalytic activity            ,385/1133,389/1188,1.07e-05,1,385,0.0023,"AAK1, ABCA12, ABCB11, ABCB6, ABCG5, ABCG8, ABHD1, AC012493.2, AC019171.1, ACADL, ACMSD, ACOXL, ACP1, ACSL3, ACVR1, ACVR1C, ACVR2A, ACYP2, ADAM17, ADAM23, ADCY3, ADI1, AGBL5, AGPS, AGXT, ALK, ALLC, ALPI, ALPP, ALPPL2, AOX1, APLF, ARL4C, ARL5A, ASNSD1, ASPRV1, ASTL, ATAD2B, ATF2, ATG4B, ATIC, ATL2, B3GALT1, B3GNT2, B3GNT7, BARD1, BCS1L, BIRC6, BMPR2, BUB1, CAB39, CAD, CALM2, CAMKMT, CAPN10, CAPN13, CAPN14, CASP10, CASP8, CDK15, CDKL4, CERKL, CERS6, CFLAR, CHPF, CHST10, CLK1, CMPK2, CNNM3, COX5B, COX7A2L, CPO, CPS1, CPSF3, CREG2, CRIM1, CTDSP1, CUL3, CYBRD1, CYP1B1, CYP20A1, CYP26B1, CYP27A1, CYP27C1, D2HGDH, DARS, DCTN1, DDX1, DDX18, DGKD, DGUOK, DHRS9, DHX57, DIS3L2, DNAH6, DNAH7, DNAJC10, DNAJC27, DNMT3A, DNPEP, DPP10, DPP4, DPYSL5, DQX1, DTYMK, DUSP11, DUSP19, DUSP2, DUSP28, ECEL1, EFEMP1, EHD3, EIF2AK2, EIF2AK3, EIF5B, EPHA4, EPT1, ERBB4, ERCC3, FAHD2A, FAHD2B, FANCL, FAP, FARSB, FASTKD1, FASTKD2, FBXO11, FIGN, FKBP1B, FKBP7, FTCDNL1, G6PC2, GAD1, GAL3ST2, GALM, GALNT13, GALNT14, GALNT3, GALNT5, GCKR, GEN1, GFPT1, GGCX, GLB1L, GLS, GMPPA, GPAT2, GPD2, GPN1, GTDC1, HAAO, HADHA, HADHB, HAT1, HDAC4, HECW2, HIBCH, HK2, HNMT, HS6ST1, HSPD1, HTR2B, HTRA2, IAH1, IDH1, IFIH1, IHH, ILKAP, INPP1, INPP4A, INPP5D, KANSL3, KCMF1, KDM3A, KHK, KYNU, LANCL1, LCLAT1, LCT, LIPT1, LONRF2, LOXL3, LPIN1, LTBP1, LYG1, LYG2, MAP3K19, MAP3K2, MAP4K3, MAP4K4, MARCH4, MARCH7, MARS2, MAT2A, MBOAT2, MCEE, MCM6, MDH1, MDH1B, MERTK, METAP1D, METTL21A, METTL5, METTL8, MGAT4A, MGAT5, MLTK, MOGAT1, MOGS, MSH2, MSH6, MTHFD2, MTIF2, MYO3B, NAGK, NCOA1, NDUFA10, NDUFAF7, NDUFB3, NDUFS1, NEU2, NEU4, NIF3L1, NRBP1, NRP2, NT5C1B, NT5C1B-RDH14, NT5DC4, ODC1, OLA1, ORC4, OSGEPL1, PAPOLG, PASK, PCYOX1, PDE11A, PDE1A, PDE6D, PDIA6, PDK1, PECR, PELI1, PGAP1, PHOSPHO2, PIGF, PIKFYVE, PKDCC, PLB1, PLCD4, PLCL1, PMS1, PNKD, PNPT1, POLE4, POLR1A, POLR1B, POLR2D, PPIG, PPIL3, PPM1B, PPM1G, PPP1CB, PPP3R1, PREPL, PRKAG3, PRKCE, PRKD3, PRKRA, PROC, PRSS56, PSMD14, PTPN18, PTPN4, PTPRN, PTRHD1, PUS10, PXDN, QPCT, RAB10, RAB17, RAB1A, RAB6C, RABL2A, RALB, RANBP2, RAPH1, RBKS, RDH14, RETSAT, REV1, RHBDD1, RHOB, RHOQ, RNASEH1, RND3, RNF103, RNF144A, RNF149, RNF181, RNF25, RNPEPL1, ROCK2, RP13-512J5.1, RPE, RPIA, RRM2, RSAD2, SAP130, SCLY, SCRN3, SGPP2, SLC3A1, SMARCAL1, SMPD4, SMYD1, SMYD5, SNRNP200, SPAST, SPEG, SPR, SRBD1, ST3GAL5, ST6GAL2, STAMBP, STEAP3, STK16, STK17B, STK25, STK36, STK39, STRADB, SUCLG1, SULT1C2, SULT1C3, SULT1C4, SULT6B1, SUMO1, SUPT7L, TDRD15, TET3, TGFA, THNSL2, THUMPD2, TLK1, TP53I3, TPO, TRABD2A, TRIB2, TRIP12, TRMT61B, TSN, TTL, TTLL4, TTN, TUBA3D, TUBA3E, TUBA4A, TYW5, UBE2E3, UBE2F, UBE2F-SCLY, UBR3, UGGT1, UGP2, UGT1A1, UGT1A10, UGT1A3, UGT1A4, UGT1A5, UGT1A6, UGT1A7, UGT1A8, UGT1A9, UPP2, USP34, USP37, USP40, UXS1, VRK2, WDSUB1, XDH, XRCC5, ZAP70, ZRANB3, ZSWIM2"
Tissue pcHi-C,Links w/ 5+ tissues vs Links w/ 1+ tissue,chr2,GO:0043169,MF,e,cation binding                ,251/1133,253/1188,0.000299,3,251,0.036,"AC012493.2, AC019171.1, ACMSD, ACVR1, ACVR1C, ACVR2A, ADAM17, ADAM23, ADCY3, ADI1, AGAP1, AGBL5, AGFG1, ALPI, ALPP, ALPPL2, ANKMY1, ANKZF1, ANTXR1, ANXA4, AOX1, APLF, ASAP2, ASTL, ASXL2, ATF2, BARD1, BAZ2B, BCL11A, BMPR2, CAD, CALM2, CAPN13, CAPN14, CDK15, CGREF1, CHN1, CHPF, CHRNA1, CHRND, CIB4, CIR1, COL3A1, COL5A2, COMMD1, COX5B, CPO, CPS1, CPSF3, CTDSP1, CYBRD1, CYP1B1, CYP20A1, CYP26B1, CYP27A1, CYP27C1, DGKD, DHX57, DNAH7, DNER, DNMT3A, DNPEP, DTNB, DYTN, ECEL1, EFEMP1, EFHD1, EGR4, EHD3, EPT1, FAHD2A, FAHD2B, FANCL, FARSB, FBLN7, FBXO11, FHL2, FKBP7, GALNT3, GCA, GEN1, GLI2, GPC1, GPD2, GPR39, HAAO, HDAC4, HPCAL1, HTR2B, IDH1, IFIH1, IHH, IKZF2, IL1A, ILKAP, ING5, INO80B, INPP1, ITGA4, ITGA6, ITGAV, ITSN2, KCMF1, KCNIP3, KDM3A, KLF11, KLF7, LANCL1, LIMS1, LIMS2, LMAN2L, LONRF2, LOXL3, LRP1B, LRP2, LTBP1, MAP3K2, MARCH4, MARCH7, MAT2A, MATN3, MCFD2, METAP1D, MGAT4A, MLPH, MLTK, MOB1A, MOB4, MSH2, MSH6, MTA3, MTHFD2, MYL1, MYT1L, NDUFS1, NFU1, NIF3L1, NLRC4, NR4A2, NRP2, NRXN1, NT5C1B, NT5C1B-RDH14, NT5DC4, OSGEPL1, OSR1, OTOF, PAPOLG, PCGF1, PDE11A, PDE1A, PHOSPHO2, PIKFYVE, PLCD4, PLCL1, PLEKHM3, PNKD, POLR1A, POLR1B, PPM1B, PPM1G, PPP1CB, PPP3R1, PRKCE, PRKD3, PROC, PSMD14, PXDN, QPCT, RANBP2, RASGRP3, REV1, RNASEH1, RNF103, RNF144A, RNF149, RNF181, RNF25, RNPEPL1, ROCK2, RP11-474G23.1, RPE, RPL37A, RPS27A, RRM2, RSAD2, RUFY4, SCN9A, SH3RF3, SLC25A12, SLC3A1, SLC5A7, SLC8A1, SMPD4, SMYD1, SMYD5, SNED1, SP100, SP110, SP140, SP140L, SP3, SP5, SP9, SRSF7, STAMBP, STAT1, STAT4, STEAP3, STK25, STK36, TAF1B, TANK, TBC1D8, TET3, THAP4, THNSL2, TMEM163, TNS1, TP53I3, TPO, TRABD2A, TRIM54, TRIP12, TTN, TYW5, UBR3, UGP2, USP39, VIL1, VSNL1, WDFY1, XDH, XIRP2, ZC3H15, ZC3H6, ZC3H8, ZDBF2, ZEB2, ZFAND2B, ZFP36L2, ZNF142, ZNF2, ZNF385B, ZNF512, ZNF513, ZNF514, ZNF638, ZNF804A, ZRANB3, ZSWIM2"
Tissue pcHi-C,Links w/ 5+ tissues vs Links w/ 1+ tissue,chr7,GO:0008150,BP,e,biological_process            ,684/836,692/860,4.11e-07,0,684,0.00254,"AASS, ABCA13, ABCB1, ABCB4, ABCB5, ABCB8, ABCF2, ABHD11, AC068533.7, ACHE, ACN9, ACTB, ACTL6B, ACTR3B, ACTR3C, ADAM22, ADAP1, ADCK2, ADCY1, ADCYAP1R1, AEBP1, AGAP3, AGBL3, AGFG2, AGK, AGMO, AGR2, AHCYL2, AHR, AIMP2, AKAP9, AKR1B1, AKR1B10, AKR1D1, ALKBH4, AMPH, AMZ1, ANKRD7, ANLN, AOAH, AOC1, AP1S1, AP4M1, AP5Z1, AQP1, ARF5, ARL4A, ARMC10, ARPC1A, ARPC1B, ASB10, ASB15, ASB4, ASIC3, ASL, ASNS, ASZ1, ATG9B, ATP5J2, ATP5J2-PTCD1, ATP6V0A4, ATP6V0E2, ATP6V1F, AUTS2, AVL9, AZGP1, BAIAP2L1, BAZ1B, BBS9, BCAP29, BCL7B, BET1, BHLHA15, BLVRA, BMPER, BPGM, BRAF, BRAT1, BUD31, BZW2, C1GALT1, C7orf55-LUC7L2, C7orf72, CACNA2D1, CADPS2, CALCR, CALD1, CALU, CAMK2B, CAPZA2, CARD11, CASP2, CAV1, CAV2, CBLL1, CBX3, CCDC126, CCL24, CCL26, CCM2, CCT6A, CD36, CDCA7L, CDHR3, CDK13, CDK14, CDK5, CDK6, CEP41, CFTR, CHCHD3, CHN2, CHPF2, CHRM2, CHST12, CLCN1, CLDN12, CLDN15, CLDN3, CLDN4, CLEC5A, CLIP2, CNOT4, CNTNAP2, COA1, COBL, COG5, COL1A2, COL26A1, COL28A1, COPG2, COPS6, CPA1, CPA2, CPA4, CPA5, CPSF4, CPVL, CRCP, CREB3L2, CREB5, CRHR2, CROT, CTAGE6, CTTNBP2, CUL1, CUX1, CYCS, CYP2W1, CYP3A4, CYP3A43, CYP3A5, CYP3A7, CYP51A1, CYTH3, DAGLB, DBF4, DBNL, DDC, DDX56, DENND2A, DFNA5, DGKB, DGKI, DLD, DLX5, DLX6, DMTF1, DNAH11, DNAJB6, DNAJB9, DNAJC2, DOCK4, DPP6, DTX2, DUS4L, DYNC1I1, EEPD1, EGFR, EIF2AK1, EIF3B, EIF4H, ELFN1, ELMO1, ELN, EN2, EPDR1, EPHA1, EPHB4, EPHB6, EPO, ERV3-1, ERVW-1, ETV1, EVX1, EXOC4, EZH2, FAM126A, FAM20C, FAM3C, FASTK, FBXO24, FERD3L, FEZF1, FIGNL1, FIS1, FKBP14, FKBP6, FKBP9, FLNC, FOXK1, FOXP2, FSCN1, FTSJ2, FZD1, FZD9, GAL3ST4, GALNT11, GALNTL5, GARS, GATAD1, GBAS, GBX1, GCC1, GCK, GET4, GGCT, GHRHR, GIGYF1, GIMAP1, GIMAP5, GJC3, GLI3, GNA12, GNAI1, GNAT3, GNB2, GNG11, GNGT1, GPC2, GPER1, GPNMB, GPR141, GPR146, GPR22, GPR37, GPR85, GRB10, GRID2IP, GRM3, GRM8, GSAP, GSTK1, GTF2I, GTF2IRD1, GTF2IRD2, GTPBP10, GUSB, H2AFV, HBP1, HDAC9, HECW1, HEPACAM2, HERPUD2, HGF, HIBADH, HILPDA, HIP1, HIPK2, HNRNPA2B1, HOXA1, HOXA10, HOXA11, HOXA13, HOXA2, HOXA3, HOXA4, HOXA5, HOXA6, HOXA7, HOXA9, HSPB1, HTR5A, HUS1, HYAL4, ICA1, IFRD1, IGF2BP3, IGFBP1, IGFBP3, IKZF1, IL6, IMMP2L, IMPDH1, ING3, INHBA, INMT, INSIG1, INTS1, IQUB, IRF5, ISPD, ITGB8, JAZF1, KCND2, KCNH2, KCTD7, KDELR2, KDM7A, KEL, KLF14, KLHL7, KMT2C, KMT2E, KPNA7, KRBA1, KRIT1, LAMB1, LAMB4, LAMTOR4, LANCL2, LAT2, LEP, LFNG, LIMK1, LMBR1, LMTK2, LRCH4, LRRC17, LRRD1, LRRN3, LRWD1, LSM5, LUC7L2, MACC1, MAD1L1, MAFK, MAGI2, MALSU1, MCM7, MDFIC, MDH2, MEOX2, MEPCE, MEST, MET, METTL2B, MGAM, MICALL2, MKLN1, MKRN1, MLXIPL, MMD2, MNX1, MOGAT3, MOSPD3, MPLKIP, MPP6, MRPL32, MRPS17, MRPS24, MRPS33, MTERF, MTPN, MUC12, MUC17, MUC3A, MYL7, NAA38, NACAD, NAMPT, NAPEPLD, NCAPG2, NDUFA4, NDUFA5, NDUFB2, NEUROD6, NFE2L3, NME8, NOBOX, NOD1, NOM1, NOS3, NPC1L1, NPSR1, NPTX2, NPVF, NPY, NRCAM, NRF1, NT5C3A, NUB1, NUDT1, NUP205, NUPL2, NYAP1, OGDH, OPN1SW, OR2A1, OR2A12, OR2A14, OR2A2, OR2A25, OR2A42, OR2A5, OR2AE1, OR2F1, OR2F2, OR6B1, OR6V1, OR9A2, OR9A4, ORC5, OSBPL3, PAPOLB, PAX4, PAXIP1, PCLO, PCOLCE, PDAP1, PDE1C, PDGFA, PDIA4, PDK4, PEG10, PEX1, PGAM2, PHKG1, PHTF2, PIK3CG, PILRA, PILRB, PKD1L1, PLEKHA8, PLOD3, PLXNA4, PMPCB, PMS2, PNPLA8, PODXL, POLD2, POLM, POLR2J, POLR2J3, POM121, POM121C, PON1, PON2, PON3, POP7, POR, POT1, POU6F2, PPIA, PPP1R17, PPP1R35, PPP1R3A, PPP1R9A, PRKAG2, PRKAR1B, PRKAR2B, PRKRIP1, PRPS1L1, PRR15, PRSS1, PRSS37, PRSS58, PSMA2, PSMC2, PSPH, PTCD1, PTN, PTPN12, PTPRN2, PTPRZ1, PURB, PUS7, RAB19, RABGEF1, RABL5, RAC1, RADIL, RALA, RAMP3, RAPGEF5, RARRES2, RASA4, RASA4B, RBAK, RBAK-RBAKDN, RBM28, RELN, REPIN1, RFC2, RHEB, RINT1, RNF133, RNF216, RP1-170O19.20, RP11-1220K2.2, RP11-514P8.7, RP9, RPA3, SAP25, SBDS, SCIN, SCRN1, SDK1, SEC61G, SEMA3A, SEMA3C, SEMA3D, SEMA3E, SEPT14, SEPT7, SERPINE1, SFRP4, SGCE, SH2B2, SHFM1, SHH, SKAP2, SLC12A9, SLC13A1, SLC13A4, SLC25A13, SLC25A40, SLC26A3, SLC26A4, SLC26A5, SLC29A4, SLC35B4, SLC37A3, SLC4A2, SMARCD3, SMO, SMURF1, SND1, SNX10, SNX13, SNX8, SOSTDC1, SP4, SP8, SPAM1, SRI, SRPK2, SRRT, SSBP1, STAG3, STEAP1, STEAP2, STEAP4, STK17A, STK31, STRA8, STRIP2, STX1A, STYXL1, SUGCT, SUMF2, SUN1, SVOPL, SYPL1, TAC1, TAF6, TAS2R16, TAS2R3, TAS2R38, TAS2R39, TAS2R40, TAS2R41, TAS2R5, TAS2R60, TAX1BP1, TBL2, TBRG4, TBX20, TBXAS1, TECPR1, TES, TFEC, TFPI2, TFR2, THAP5, THSD7A, TMED4, TMEM106B, TMEM176A, TMEM176B, TMEM184A, TNPO3, TNS3, TOMM7, TPK1, TPST1, TRA2A, TRGV3, TRIM24, TRIM4, TRIM56, TRIP6, TRPV5, TRPV6, TRRAP, TSC22D4, TSPAN12, TSRM, TTC26, TTYH3, TWIST1, TWISTNB, TYW1, UBE2D4, UBE2H, UBE3C, UFSP1, UNCX, UPK3B, UPP1, URGCP, USP42, VGF, VIPR2, VOPP1, VPS37D, VPS41, VWC2, WASL, WBSCR16, WBSCR17, WBSCR22, WBSCR27, WEE2, WIPF3, WIPI2, WNT16, WNT2, XRCC2, YKT6, YWHAG, ZAN, ZC3HAV1, ZC3HC1, ZKSCAN1, ZKSCAN5, ZMIZ2, ZNF107, ZNF117, ZNF12, ZNF138, ZNF212, ZNF273, ZNF277, ZNF282, ZNF3, ZNF394, ZNF398, ZNF425, ZNF467, ZNF479, ZNF655, ZNF679, ZNF680, ZNF713, ZNF716, ZNF727, ZNF736, ZNF746, ZNF775, ZNF777, ZNF783, ZNF786, ZNF789, ZNF800, ZNF862, ZNF92, ZNHIT1, ZNRF2, ZP3, ZPBP, ZSCAN21, ZSCAN25, ZYX"
Tissue pcHi-C,Links w/ 5+ tissues vs Links w/ 1+ tissue,chr7,GO:0009987,BP,e,cellular process              ,599/836,605/860,4.25e-06,1,599,0.00874,"AASS, ABCB1, ABCB4, ABCB5, ABCB8, ABHD11, AC068533.7, ACHE, ACTB, ACTL6B, ACTR3B, ACTR3C, ADAM22, ADAP1, ADCK2, ADCY1, ADCYAP1R1, AEBP1, AGAP3, AGK, AGMO, AGR2, AHCYL2, AHR, AIMP2, AKAP9, AKR1B1, AKR1B10, AKR1D1, ALKBH4, AMPH, ANLN, AOAH, AOC1, AP1S1, AP4M1, AP5Z1, AQP1, ARF5, ARL4A, ARMC10, ARPC1A, ARPC1B, ASB10, ASB15, ASB4, ASIC3, ASL, ASNS, ASZ1, ATG9B, ATP5J2, ATP5J2-PTCD1, ATP6V0A4, ATP6V0E2, ATP6V1F, AVL9, AZGP1, BAIAP2L1, BAZ1B, BBS9, BCAP29, BET1, BHLHA15, BLVRA, BMPER, BPGM, BRAF, BZW2, C1GALT1, C7orf55-LUC7L2, CADPS2, CALCR, CALU, CAMK2B, CAPZA2, CARD11, CASP2, CAV1, CAV2, CBLL1, CBX3, CCL24, CCL26, CCM2, CCT6A, CD36, CDCA7L, CDHR3, CDK13, CDK14, CDK5, CDK6, CEP41, CFTR, CHCHD3, CHN2, CHPF2, CHRM2, CHST12, CLCN1, CLDN12, CLDN15, CLDN3, CLDN4, CLEC5A, CNOT4, CNTNAP2, COA1, COBL, COG5, COL1A2, COL26A1, COL28A1, COPG2, CPSF4, CRCP, CREB3L2, CREB5, CRHR2, CROT, CUL1, CUX1, CYCS, CYP2W1, CYP3A4, CYP3A43, CYP3A5, CYP3A7, CYP51A1, CYTH3, DAGLB, DBF4, DBNL, DDC, DDX56, DENND2A, DFNA5, DGKB, DGKI, DLD, DLX5, DLX6, DMTF1, DNAH11, DNAJB6, DNAJB9, DNAJC2, DOCK4, DPP6, DTX2, DUS4L, DYNC1I1, EEPD1, EGFR, EIF2AK1, EIF3B, EIF4H, ELFN1, ELMO1, ELN, EN2, EPDR1, EPHA1, EPHB4, EPHB6, EPO, ERVW-1, ETV1, EXOC4, EZH2, FAM126A, FAM20C, FASTK, FERD3L, FEZF1, FIGNL1, FIS1, FKBP14, FKBP6, FKBP9, FLNC, FOXK1, FOXP2, FSCN1, FTSJ2, FZD1, FZD9, GAL3ST4, GALNT11, GARS, GBAS, GBX1, GCC1, GCK, GET4, GGCT, GHRHR, GIGYF1, GIMAP1, GIMAP5, GJC3, GLI3, GNA12, GNAI1, GNAT3, GNB2, GNG11, GNGT1, GPC2, GPER1, GPNMB, GPR141, GPR146, GPR22, GPR37, GPR85, GRB10, GRM3, GRM8, GSTK1, GTF2I, GTF2IRD2, GTPBP10, H2AFV, HBP1, HDAC9, HECW1, HEPACAM2, HGF, HIBADH, HILPDA, HIP1, HIPK2, HNRNPA2B1, HOXA1, HOXA10, HOXA11, HOXA13, HOXA2, HOXA3, HOXA4, HOXA5, HOXA6, HOXA7, HOXA9, HSPB1, HTR5A, HUS1, HYAL4, IFRD1, IGF2BP3, IGFBP1, IGFBP3, IKZF1, IL6, IMPDH1, ING3, INHBA, INSIG1, INTS1, IQUB, IRF5, ISPD, ITGB8, JAZF1, KCND2, KCNH2, KCTD7, KDELR2, KDM7A, KLF14, KMT2C, KMT2E, KPNA7, KRIT1, LAMB1, LAMB4, LAMTOR4, LAT2, LEP, LFNG, LIMK1, LMTK2, LRRD1, LRWD1, LSM5, LUC7L2, MACC1, MAD1L1, MAFK, MAGI2, MALSU1, MCM7, MDFIC, MDH2, MEPCE, MET, METTL2B, MGAM, MICALL2, MKLN1, MLXIPL, MMD2, MNX1, MOGAT3, MPLKIP, MPP6, MRPL32, MRPS17, MRPS24, MRPS33, MTERF, MTPN, MUC17, MYL7, NAA38, NACAD, NAMPT, NAPEPLD, NCAPG2, NDUFA4, NDUFA5, NDUFB2, NEUROD6, NFE2L3, NME8, NOBOX, NOD1, NOS3, NPSR1, NPTX2, NPVF, NPY, NRCAM, NRF1, NT5C3A, NUB1, NUDT1, NUP205, NUPL2, NYAP1, OGDH, OPN1SW, OR2A1, OR2A12, OR2A14, OR2A2, OR2A25, OR2A42, OR2A5, OR2AE1, OR2F1, OR2F2, OR6B1, OR6V1, OR9A2, OR9A4, ORC5, PAPOLB, PAX4, PAXIP1, PCLO, PDAP1, PDE1C, PDGFA, PDIA4, PDK4, PEG10, PEX1, PGAM2, PHKG1, PHTF2, PIK3CG, PILRA, PILRB, PKD1L1, PLEKHA8, PLOD3, PLXNA4, PMPCB, PMS2, PNPLA8, PODXL, POLD2, POLM, POLR2J, POLR2J3, POM121, POM121C, PON1, PON2, PON3, POP7, POR, POT1, POU6F2, PPIA, PPP1R17, PPP1R3A, PPP1R9A, PRKAG2, PRKAR1B, PRKAR2B, PRPS1L1, PRSS1, PSMA2, PSMC2, PSPH, PTCD1, PTN, PTPN12, PTPRN2, PTPRZ1, PURB, PUS7, RAB19, RABGEF1, RABL5, RAC1, RADIL, RALA, RAMP3, RAPGEF5, RARRES2, RASA4, RASA4B, RBAK, RBAK-RBAKDN, RBM28, RELN, REPIN1, RFC2, RHEB, RINT1, RNF216, RP11-514P8.7, RP9, RPA3, SAP25, SBDS, SCIN, SCRN1, SDK1, SEC61G, SEMA3A, SEMA3C, SEMA3D, SEMA3E, SEPT14, SEPT7, SERPINE1, SFRP4, SGCE, SH2B2, SHFM1, SHH, SKAP2, SLC12A9, SLC13A1, SLC13A4, SLC25A13, SLC25A40, SLC26A3, SLC26A4, SLC26A5, SLC29A4, SLC35B4, SLC37A3, SLC4A2, SMARCD3, SMO, SMURF1, SND1, SNX10, SNX13, SNX8, SOSTDC1, SP4, SP8, SPAM1, SRI, SRPK2, SRRT, SSBP1, STAG3, STEAP2, STEAP4, STK17A, STK31, STRA8, STRIP2, STX1A, STYXL1, SUN1, SVOPL, SYPL1, TAC1, TAF6, TAS2R16, TAS2R3, TAS2R38, TAS2R39, TAS2R40, TAS2R41, TAS2R5, TAS2R60, TAX1BP1, TBRG4, TBX20, TBXAS1, TECPR1, TFEC, TFR2, THAP5, THSD7A, TMED4, TMEM176B, TNS3, TOMM7, TPK1, TPST1, TRA2A, TRIM24, TRIM4, TRIP6, TRPV5, TRPV6, TRRAP, TSC22D4, TSPAN12, TSRM, TTC26, TTYH3, TWIST1, TWISTNB, TYW1, UBE2H, UBE3C, UNCX, UPP1, URGCP, USP42, VGF, VIPR2, VOPP1, VPS37D, VPS41, WASL, WBSCR22, WEE2, WIPF3, WIPI2, WNT16, WNT2, XRCC2, YKT6, YWHAG, ZAN, ZC3HAV1, ZC3HC1, ZKSCAN1, ZKSCAN5, ZMIZ2, ZNF107, ZNF117, ZNF12, ZNF138, ZNF212, ZNF273, ZNF277, ZNF282, ZNF3, ZNF394, ZNF398, ZNF425, ZNF467, ZNF479, ZNF655, ZNF679, ZNF680, ZNF713, ZNF716, ZNF727, ZNF736, ZNF746, ZNF775, ZNF777, ZNF783, ZNF786, ZNF789, ZNF800, ZNF862, ZNF92, ZP3, ZPBP, ZSCAN21, ZSCAN25, ZYX"
Tissue pcHi-C,Links w/ 5+ tissues vs Links w/ 1+ tissue,chr7,GO:0110165,CC,e,cellular anatomical entity    ,728/836,739/860,2.96e-06,1,728,0.00874,"AASS, ABCA13, ABCB1, ABCB4, ABCB5, ABCB8, ABCF2, ABHD11, ACHE, ACN9, ACTB, ACTL6B, ACTR3B, ADAM22, ADAP1, ADCK2, ADCY1, ADCYAP1R1, AEBP1, AGAP3, AGBL3, AGK, AGMO, AGR2, AGR3, AHR, AIMP2, AKAP9, AKR1B1, AKR1B10, AKR1D1, ALKBH4, AMPH, ANKMY2, ANKRD7, ANLN, AOAH, AOC1, AP1S1, AP4M1, AP5Z1, AQP1, ARF5, ARL4A, ARMC10, ARPC1A, ARPC1B, ASB10, ASIC3, ASL, ASNS, ASZ1, ATG9B, ATP5J2, ATP5J2-PTCD1, ATP6V0A4, ATP6V0E2, ATP6V1F, AVL9, AZGP1, BAIAP2L1, BAZ1B, BBS9, BCAP29, BET1, BHLHA15, BLVRA, BMPER, BRAF, BRAT1, BRI3, BUD31, C1GALT1, C7orf13, C7orf34, C7orf49, C7orf55, C7orf55-LUC7L2, C7orf66, C7orf69, C7orf73, CACNA2D1, CADPS2, CALCR, CALD1, CALN1, CALU, CAMK2B, CAPZA2, CARD11, CASD1, CASP2, CAV1, CAV2, CBX3, CCDC126, CCDC136, CCL24, CCL26, CCM2, CCT6A, CCZ1, CCZ1B, CD36, CDCA7L, CDHR3, CDK13, CDK14, CDK5, CDK6, CEP41, CFTR, CHCHD2, CHCHD3, CHN2, CHPF2, CHRM2, CHST12, CLCN1, CLDN12, CLDN15, CLDN3, CLDN4, CLEC2L, CLEC5A, CLIP2, CNOT4, CNPY4, CNTNAP2, COBL, COG5, COL1A2, COL26A1, COL28A1, COPS6, COX19, CPA1, CPA2, CPA4, CPA5, CPED1, CPSF4, CRCP, CREB3L2, CREB5, CRHR2, CROT, CTAGE6, CTTNBP2, CUL1, CUX1, CYCS, CYP2W1, CYP3A4, CYP3A43, CYP3A5, CYP3A7, CYP51A1, CYTH3, DAGLB, DBF4, DBNL, DDC, DDX56, DENND2A, DFNA5, DGKB, DGKI, DLD, DLX5, DLX6, DMTF1, DNAH11, DNAJB6, DNAJB9, DNAJC2, DNAJC30, DOCK4, DPP6, DPY19L1, DTX2, DYNC1I1, EEPD1, EGFR, EIF2AK1, EIF3B, EIF4H, ELFN1, ELMO1, ELN, EN2, EPDR1, EPHA1, EPHB4, EPHB6, EPO, ERVW-1, ESYT2, ETV1, EVX1, EXOC4, EZH2, FAM126A, FAM180A, FAM185A, FAM200A, FAM20C, FAM220A, FAM3C, FASTK, FERD3L, FEZF1, FIGNL1, FIS1, FKBP14, FKBP6, FKBP9, FLNC, FOXK1, FOXP2, FSCN1, FSCN3, FTSJ2, FZD1, FZD9, GAL3ST4, GALNT11, GALNTL5, GARS, GATAD1, GBAS, GBX1, GCC1, GCK, GET4, GGCT, GHRHR, GIMAP1, GIMAP2, GIMAP4, GIMAP5, GIMAP6, GIMAP7, GIMAP8, GJC3, GLCCI1, GLI3, GNA12, GNAI1, GNAT3, GNB2, GNG11, GNGT1, GPC2, GPER1, GPNMB, GPR141, GPR146, GPR22, GPR37, GPR85, GRB10, GRID2IP, GRM3, GRM8, GSAP, GSTK1, GTF2I, GTF2IRD1, GTF2IRD2, GTPBP10, GUSB, H2AFV, HBP1, HDAC9, HEATR2, HECW1, HEPACAM2, HERPUD2, HGF, HIBADH, HILPDA, HIP1, HIPK2, HNRNPA2B1, HOXA1, HOXA10, HOXA11, HOXA13, HOXA2, HOXA3, HOXA4, HOXA5, HOXA6, HOXA7, HOXA9, HSPB1, HTR5A, HUS1, HYAL4, ICA1, IFRD1, IGF2BP3, IGFBP1, IGFBP3, IKZF1, IL6, IMMP2L, IMPDH1, INHBA, INMT, INSIG1, INTS1, IQCE, IQUB, IRF5, ITGB8, KCND2, KCNH2, KCTD7, KDELR2, KDM7A, KEL, KIAA1324L, KIAA1549, KLF14, KLHDC10, KLHL7, KLRG2, KMT2C, KMT2E, KPNA7, KRIT1, LAMB1, LAMB4, LAMTOR4, LANCL2, LAT2, LEP, LFNG, LHFPL3, LIMK1, LINC00998, LMBR1, LMOD2, LMTK2, LRCH4, LRRC17, LRRC4, LRRN3, LRWD1, LSM5, LSMEM1, MACC1, MAD1L1, MAFK, MAGI2, MALSU1, MCM7, MDFIC, MDH2, MEOX2, MEST, MET, MGAM, MICALL2, MIOS, MKLN1, MLXIPL, MMD2, MNX1, MOGAT3, MOSPD3, MPLKIP, MPP6, MRPL32, MRPS17, MRPS24, MRPS33, MTERF, MTPN, MTRNR2L6, MUC12, MUC17, MUC3A, MYL10, MYL7, MYO1G, NAA38, NACAD, NAMPT, NAPEPLD, NCAPG2, NDUFA4, NDUFA5, NDUFB2, NEUROD6, NFE2L3, NME8, NOBOX, NOD1, NOM1, NOS3, NPC1L1, NPSR1, NPTX2, NPVF, NPY, NRCAM, NRF1, NT5C3A, NUB1, NUDT1, NUP205, NUPL2, NXPH1, OGDH, OPN1SW, OR2A1, OR2A12, OR2A14, OR2A2, OR2A25, OR2A42, OR2A5, OR2AE1, OR2F1, OR2F2, OR6B1, OR6V1, OR9A2, OR9A4, ORAI2, ORC5, OSBPL3, PAPOLB, PARP12, PAX4, PAXIP1, PCLO, PCOLCE, PDE1C, PDGFA, PDIA4, PDK4, PEG10, PEX1, PGAM2, PHKG1, PHTF2, PIK3CG, PILRA, PILRB, PIP, PKD1L1, PLEKHA8, PLOD3, PLXNA4, PMPCB, PMS2, PNPLA8, PODXL, POLD2, POLM, POLR2J, POLR2J3, POM121, POM121C, PON1, PON2, PON3, POP7, POR, POT1, POU6F2, PPIA, PPP1R3A, PPP1R9A, PRKAG2, PRKAR1B, PRKAR2B, PRKRIP1, PRRT4, PRSS1, PRSS37, PRSS58, PSMA2, PSMC2, PSPH, PTCD1, PTN, PTPN12, PTPRN2, PTPRZ1, PURB, PVRIG, RAB19, RABGEF1, RABL5, RAC1, RALA, RAMP3, RAPGEF5, RARRES2, RASA4, RASA4B, RBAK, RBAK-RBAKDN, RBM28, RBM48, RELN, REPIN1, RFC2, RHBDD2, RHEB, RINT1, RNF133, RNF148, RNF216, RNF32, RP1-170O19.20, RP11-1220K2.2, RP9, RPA3, RSBN1L, SAMD9, SAP25, SBDS, SCIN, SCRN1, SDK1, SEC61G, SEMA3A, SEMA3C, SEMA3D, SEMA3E, SEPT7, SERPINE1, SFRP4, SGCE, SH2B2, SHH, SKAP2, SLC12A9, SLC13A1, SLC13A4, SLC25A13, SLC25A40, SLC26A3, SLC26A4, SLC26A5, SLC29A4, SLC35B4, SLC37A3, SLC4A2, SMARCD3, SMO, SMURF1, SND1, SNX10, SNX13, SNX8, SOSTDC1, SP4, SP8, SPAM1, SRCRB4D, SRI, SRPK2, SRRT, SSBP1, SSMEM1, ST7, STAG3, STARD3NL, STEAP1, STEAP1B, STEAP2, STEAP4, STK17A, STRA8, STRIP2, STX1A, SUGCT, SUMF2, SUN1, SUN3, SVOPL, SYPL1, TAC1, TAF6, TAS2R16, TAS2R3, TAS2R38, TAS2R39, TAS2R40, TAS2R41, TAS2R5, TAS2R60, TAX1BP1, TBRG4, TBX20, TBXAS1, TECPR1, TES, TFEC, TFPI2, TFR2, THAP5, THSD7A, TMED4, TMEM106B, TMEM130, TMEM139, TMEM140, TMEM168, TMEM176A, TMEM176B, TMEM178B, TMEM184A, TMEM196, TMEM209, TMEM213, TMEM229A, TMEM243, TMEM248, TMEM60, TMUB1, TNPO3, TNS3, TOMM7, TPK1, TPST1, TRA2A, TRBC2, TRGV3, TRIM24, TRIM4, TRIM50, TRIM56, TRIP6, TRPV5, TRPV6, TRRAP, TSC22D4, TSPAN12, TSPAN13, TSPAN33, TSRM, TTC26, TTYH3, TWIST1, TWISTNB, UBE3C, UBN2, UNCX, UPK3B, UPP1, URGCP, VGF, VIPR2, VKORC1L1, VOPP1, VPS37D, VPS41, VSTM2A, VWC2, VWDE, WASL, WBSCR16, WBSCR17, WBSCR22, WBSCR28, WDR60, WEE2, WIPF3, WIPI2, WNT16, WNT2, XRCC2, YKT6, YWHAG, ZAN, ZC3HAV1, ZC3HC1, ZDHHC4, ZFAND2A, ZKSCAN1, ZKSCAN5, ZMIZ2, ZNF107, ZNF117, ZNF12, ZNF138, ZNF212, ZNF273, ZNF277, ZNF282, ZNF3, ZNF394, ZNF398, ZNF425, ZNF467, ZNF479, ZNF655, ZNF679, ZNF680, ZNF713, ZNF716, ZNF727, ZNF736, ZNF746, ZNF775, ZNF777, ZNF783, ZNF786, ZNF789, ZNF800, ZNF804B, ZNF862, ZNF92, ZNHIT1, ZNRF2, ZP3, ZPBP, ZSCAN21, ZSCAN25, ZYX"
