DS,What,chr,GO,NS,enrichment,name,ratio_in_study,ratio_in_pop,p_uncorrected,depth,study_count,p_fdr_bh,study_items
Randomized tissue pcHi-C,Links w/ 5+ tissues vs Links w/ 1+ tissue,chr14,GO:0009987,BP,e,cellular process              ,417/613,420/676,5.15e-24,1,417,6.16e-21,"ABCD4, ACIN1, ACOT1, ACOT2, ACOT4, ACTN1, ACTR10, ACYP1, ADAM20, ADAM21, ADCK1, ADCY4, ADSSL1, AJUBA, AK7, AKAP5, AKAP6, AKT1, ALDH6A1, ALKBH1, AMN, ANG, AP1G2, AP4S1, AP5M1, APEX1, APOPT1, AREL1, ARF6, ARG2, ARHGAP5, ARID4A, ASB2, ASPG, ATG14, ATG2B, ATL1, ATP5S, ATP6V1D, ATXN3, BAG5, BATF, BAZ1A, BCL11B, BCL2L2, BCL2L2-PABPN1, BDKRB1, BDKRB2, BMP4, BRF1, BRMS1L, C14orf166, CALM1, CATSPERB, CCDC176, CCDC88C, CCNB1IP1, CCNK, CDC42BPB, CDH24, CDKL1, CDKN3, CEBPE, CFL2, CHD8, CHMP4A, CHURC1, CHURC1-FNTB, CIDEB, CINP, CKB, CLMN, CMA1, CNIH1, COQ6, CPNE6, CPSF2, CRIP1, CRIP2, CTSG, CYP46A1, DAAM1, DACT1, DAD1, DDHD1, DDX24, DEGS2, DHRS2, DHRS4, DICER1, DIO2, DIO3, DLGAP5, DLK1, DLST, DNAAF2, DPF3, DTD2, DYNC1H1, EDDM3B, EFS, EGLN3, EIF2B2, EIF2S1, EIF5, ELMSAN1, ENTPD5, ERH, ERO1L, ESR2, ESRRB, EVL, EXD2, EXOC3L4, EXOC5, FANCM, FBLN5, FCF1, FERMT2, FITM1, FKBP3, FLRT2, FLVCR2, FNTB, FOS, FOXA1, FOXG1, FOXN3, FRMD6, FSCB, FUT8, G2E3, GALC, GCH1, GEMIN2, GLRX5, GMFB, GMPR2, GNG2, GNPNAT1, GOLGA5, GPHN, GPR132, GPR135, GPR65, GPR68, GSC, GSTZ1, GTF2A1, GZMB, GZMH, HAUS4, HECTD1, HIF1A, HNRNPC, HOMEZ, HSP90AA1, HSPA2, IFI27, IFT43, IGHG1, IL25, INF2, INSM2, IPO4, IRF9, ISCA2, ITPK1, JAG2, JDP2, JKAMP, JPH4, KCNH5, KCNK10, KCNK13, KIAA0391, KIAA0586, KIF26A, KLC1, KTN1, L2HGDH, LGALS3, LGMN, LIN52, LTB4R, LTB4R2, LTBP2, MAP3K9, MAP4K5, MARK3, MAX, MBIP, MDGA2, MED6, METTL17, METTL3, MIS18BP1, MLH3, MMP14, MNAT1, MOAP1, MOK, MPP5, MRPL52, MTA1, MTHFD1, MYH6, MYH7, NDRG2, NDUFB1, NEDD8, NEDD8-MDP1, NEK9, NEMF, NFATC4, NFKBIA, NGB, NID2, NIN, NKX2-1, NKX2-8, NOVA1, NOXRED1, NPAS3, NPC2, NRL, NRXN3, NUBPL, NUMB, NYNRIN, OR10G2, OR10G3, OR11G2, OR11H4, OR11H6, OR4E2, OR4K1, OR4K13, OR4K14, OR4K15, OR4K17, OR4K2, OR4K5, OR4L1, OR4M1, OR4N2, OR4N5, OR4Q3, OR5AU1, OR6J1, OR6S1, OSGEP, OTUB2, OTX2, OXA1L, PABPN1, PACS2, PAPOLA, PARP2, PAX9, PCK2, PELI2, PGF, PIGH, PLD4, PLEK2, PNMA1, PNN, PNP, POLE2, PPM1A, PPP1R13B, PPP1R3E, PPP2R5C, PPP2R5E, PRIMA1, PRKCH, PRKD1, PRMT5, PROX2, PRPF39, PSEN1, PSMA3, PSMA6, PSMB11, PSMB5, PSMC1, PSMC6, PSME1, PSME2, PTGDR, PTGER2, PTGR2, PTPN21, PYGL, RAB15, RAB2B, RABGGTA, RAD51B, RBM23, RBM25, RCOR1, RDH11, RDH12, REC8, REM2, RGS6, RHOJ, RIN3, RIPK3, RNASE10, RNASE2, RNASE3, RNASE4, RNASE6, RNF31, RP11-1012A1.4, RP11-176H8.1, RP11-47I22.4, RP11-73M18.2, RPGRIP1, RPL10L, RPL36AL, RPS29, RPS6KA5, RPS6KL1, RTN1, SALL2, SAV1, SCFD1, SDR39U1, SEC23A, SEL1L, SERPINA1, SERPINA5, SETD3, SGPP1, SIPA1L1, SIVA1, SIX1, SIX4, SLC10A1, SLC22A17, SLC24A4, SLC25A21, SLC25A47, SLC39A2, SLC39A9, SLC7A7, SLC7A8, SLC8A3, SLIRP, SMEK1, SMOC1, SNAPC1, SNW1, SNX6, SOCS4, SOS2, SPTB, SPTLC2, SPTSSA, SRP54, SRSF5, SSTR1, STON2, STYX, SUPT16H, SYNE2, SYNE3, SYNJ2BP, TBPL2, TDP1, TDRD9, TECPR2, TEP1, TGFB3, TGM1, THTPA, TIMM9, TINF2, TM9SF1, TMED10, TMX1, TNFAIP2, TOMM20L, TRAF3, TRIM9, TRIP11, TRMT61A, TSHR, TSSK4, TTC5, TTC8, TTLL5, TXNDC16, UNC79, VCPKMT, VIPAS39, VRK1, VRTN, VSX2, VTI1B, WARS, WDHD1, XRCC3, YLPM1, YY1, ZBTB1, ZBTB25, ZBTB42, ZDHHC22, ZFHX2, ZFP36L1, ZFYVE26, ZNF219, ZNF410"
Randomized tissue pcHi-C,Links w/ 5+ tissues vs Links w/ 1+ tissue,chr14,GO:0008152,BP,e,metabolic process             ,278/613,278/676,5.28e-16,1,278,3.61e-13,"ABCD4, ABHD12B, ABHD4, ACIN1, ACOT1, ACOT2, ACOT4, ACYP1, ADAM20, ADAM21, ADCK1, ADCY4, ADSSL1, AJUBA, AK7, AKAP5, AKT1, ALDH6A1, ALKBH1, AMN, ANG, APEX1, AREL1, ARG2, ARID4A, ASB2, ASPG, ATG14, ATG2B, ATP5S, ATXN3, BATF, BAZ1A, BCL11B, BMP4, BRF1, BRMS1L, C14orf1, C14orf166, CALM1, CCNB1IP1, CCNK, CDC42BPB, CDKL1, CDKN3, CEBPE, CHD8, CHURC1, CHURC1-FNTB, CINP, CKB, CMA1, COQ6, CPNE6, CPSF2, CTSG, CYP46A1, DAD1, DCAF11, DCAF4, DCAF5, DDHD1, DDX24, DEGS2, DHRS1, DHRS2, DHRS4, DHRS4L2, DHRS7, DICER1, DIO2, DIO3, DLST, DPF3, DTD2, EGLN3, EIF2B2, EIF2S1, EIF5, ELMSAN1, ENTPD5, ERH, ERO1L, ESR2, ESRRB, EXD2, EXOC5, FANCM, FBXO33, FCF1, FKBP3, FNTB, FOS, FOXA1, FOXG1, FOXN3, FSCB, FUT8, G2E3, GALC, GALNT16, GCH1, GEMIN2, GMFB, GMPR2, GNG2, GNPNAT1, GPHN, GSTZ1, GTF2A1, GZMB, GZMH, HECTD1, HHIPL1, HIF1A, HNRNPC, HOMEZ, HSP90AA1, INSM2, IRF9, ISCA2, ITPK1, JAG2, JDP2, JKAMP, KIAA0391, L2HGDH, L3HYPDH, LGALS3, LGMN, LIN52, LRR1, MAP3K9, MAP4K5, MARK3, MAX, MBIP, MED6, METTL17, METTL3, MGAT2, MLH3, MMP14, MNAT1, MOK, MRPL52, MTHFD1, NDUFB1, NEDD8, NEDD8-MDP1, NEK9, NFATC4, NKX2-1, NKX2-8, NOVA1, NOXRED1, NPAS3, NPC2, NRL, NYNRIN, OSGEP, OTUB2, OXA1L, PABPN1, PAPOLA, PARP2, PAX9, PCK2, PELI2, PIGH, PLD4, PNN, PNP, POLE2, POMT2, PPM1A, PPP1R3E, PPP2R5C, PRIMA1, PRKCH, PRKD1, PRMT5, PROX2, PRPF39, PSEN1, PSMA3, PSMA6, PSMB11, PSMB5, PSMC1, PSMC6, PSME1, PSME2, PTGDR, PTGR2, PTPN21, PYGL, RABGGTA, RAD51B, RBM23, RBM25, RCOR1, RDH11, RDH12, REC8, RIPK3, RNASE2, RNASE3, RNASE4, RNASE6, RNF31, RP11-176H8.1, RP11-47I22.4, RPL10L, RPL36AL, RPS29, RPS6KA5, RPS6KL1, SALL2, SDR39U1, SEC23A, SERPINA6, SETD3, SGPP1, SIX1, SLC10A1, SLC25A21, SLC7A7, SLC7A8, SLIRP, SMEK1, SNAPC1, SNW1, SOCS4, SPTB, SPTLC2, SPTSSA, SRP54, SRSF5, STYX, SUPT16H, TBPL2, TDP1, TDRD9, TECPR2, TEP1, TGM1, THTPA, TIMM9, TINF2, TM9SF1, TMED10, TMX1, TRIM9, TRIP11, TRMT61A, TSSK4, TTC5, TTLL5, VCPKMT, VIPAS39, VRK1, VRTN, VSX2, WARS, WDHD1, XRCC3, YLPM1, YY1, ZBTB1, ZBTB25, ZBTB42, ZDHHC22, ZFHX2, ZFP36L1, ZFYVE26, ZNF219, ZNF410"
Randomized tissue pcHi-C,Links w/ 5+ tissues vs Links w/ 1+ tissue,chr14,GO:0071704,BP,e,organic substance metabolic process,260/613,260/676,1.39e-14,2,260,6.65e-12,"ABCD4, ABHD12B, ABHD4, ACIN1, ACOT1, ACOT2, ACOT4, ADAM20, ADAM21, ADCK1, ADCY4, ADSSL1, AJUBA, AK7, AKT1, ALDH6A1, ALKBH1, AMN, ANG, APEX1, AREL1, ARG2, ARID4A, ASB2, ASPG, ATP5S, ATXN3, BATF, BAZ1A, BCL11B, BMP4, BRF1, BRMS1L, C14orf1, C14orf166, CALM1, CCNB1IP1, CCNK, CDC42BPB, CDKL1, CDKN3, CEBPE, CHD8, CHURC1, CHURC1-FNTB, CINP, CKB, CMA1, COQ6, CPNE6, CPSF2, CTSG, CYP46A1, DAD1, DCAF11, DCAF4, DCAF5, DDHD1, DDX24, DEGS2, DHRS2, DHRS4, DICER1, DIO2, DIO3, DLST, DPF3, DTD2, EGLN3, EIF2B2, EIF2S1, EIF5, ELMSAN1, ENTPD5, ERH, ERO1L, ESR2, ESRRB, EXD2, EXOC5, FANCM, FBXO33, FCF1, FKBP3, FNTB, FOS, FOXG1, FOXN3, FSCB, FUT8, G2E3, GALC, GALNT16, GCH1, GEMIN2, GMFB, GMPR2, GNPNAT1, GPHN, GSTZ1, GTF2A1, GZMB, GZMH, HECTD1, HHIPL1, HIF1A, HNRNPC, HOMEZ, INSM2, IRF9, ITPK1, JAG2, JDP2, JKAMP, KIAA0391, L2HGDH, LGALS3, LGMN, LIN52, LRR1, MAP3K9, MAP4K5, MARK3, MAX, MBIP, MED6, METTL17, METTL3, MGAT2, MLH3, MMP14, MNAT1, MOK, MRPL52, MTHFD1, NEDD8, NEDD8-MDP1, NEK9, NFATC4, NKX2-1, NKX2-8, NOVA1, NOXRED1, NPAS3, NPC2, NRL, NYNRIN, OSGEP, OTUB2, PABPN1, PAPOLA, PARP2, PAX9, PCK2, PELI2, PIGH, PLD4, PNN, PNP, POLE2, POMT2, PPM1A, PPP1R3E, PPP2R5C, PRKCH, PRKD1, PRMT5, PROX2, PRPF39, PSEN1, PSMA3, PSMA6, PSMB11, PSMB5, PSMC1, PSMC6, PSME1, PSME2, PTGDR, PTGR2, PTPN21, PYGL, RABGGTA, RAD51B, RBM23, RBM25, RCOR1, RDH11, RDH12, REC8, RIPK3, RNASE2, RNASE3, RNASE4, RNASE6, RNF31, RP11-176H8.1, RP11-47I22.4, RPL10L, RPL36AL, RPS29, RPS6KA5, RPS6KL1, SALL2, SEC23A, SERPINA6, SETD3, SGPP1, SIX1, SLC10A1, SLC25A21, SLC7A7, SLC7A8, SLIRP, SMEK1, SNAPC1, SNW1, SOCS4, SPTB, SPTLC2, SPTSSA, SRP54, SRSF5, STYX, SUPT16H, TBPL2, TDP1, TDRD9, TEP1, TGM1, THTPA, TIMM9, TINF2, TMED10, TMX1, TRIM9, TRIP11, TRMT61A, TSSK4, TTC5, TTLL5, VCPKMT, VIPAS39, VRK1, VRTN, VSX2, WARS, WDHD1, XRCC3, YLPM1, YY1, ZBTB1, ZBTB25, ZBTB42, ZDHHC22, ZFHX2, ZFP36L1, ZFYVE26, ZNF219, ZNF410"
Randomized tissue pcHi-C,Links w/ 5+ tissues vs Links w/ 1+ tissue,chr14,GO:0044238,BP,e,primary metabolic process     ,250/613,250/676,4.51e-14,2,250,1.96e-11,"ABHD12B, ABHD4, ACIN1, ACOT1, ACOT2, ACOT4, ADAM20, ADAM21, ADCK1, ADCY4, ADSSL1, AJUBA, AK7, AKT1, ALDH6A1, ALKBH1, AMN, ANG, APEX1, AREL1, ARG2, ARID4A, ASB2, ASPG, ATP5S, ATXN3, BATF, BAZ1A, BCL11B, BMP4, BRF1, BRMS1L, C14orf1, C14orf166, CALM1, CCNB1IP1, CCNK, CDC42BPB, CDKL1, CDKN3, CEBPE, CHD8, CHURC1, CHURC1-FNTB, CINP, CMA1, CPNE6, CPSF2, CTSG, CYP46A1, DAD1, DCAF11, DCAF4, DCAF5, DDHD1, DDX24, DEGS2, DHRS2, DHRS4, DICER1, DLST, DPF3, DTD2, EGLN3, EIF2B2, EIF2S1, EIF5, ELMSAN1, ENTPD5, ERH, ERO1L, ESR2, ESRRB, EXD2, EXOC5, FANCM, FBXO33, FCF1, FKBP3, FNTB, FOS, FOXG1, FOXN3, FSCB, FUT8, G2E3, GALC, GALNT16, GEMIN2, GMFB, GMPR2, GNPNAT1, GSTZ1, GTF2A1, GZMB, GZMH, HECTD1, HHIPL1, HIF1A, HNRNPC, HOMEZ, INSM2, IRF9, JAG2, JDP2, JKAMP, KIAA0391, L2HGDH, LGALS3, LGMN, LIN52, LRR1, MAP3K9, MAP4K5, MARK3, MAX, MBIP, MED6, METTL17, METTL3, MGAT2, MLH3, MMP14, MNAT1, MOK, MRPL52, MTHFD1, NEDD8, NEDD8-MDP1, NEK9, NFATC4, NKX2-1, NKX2-8, NOVA1, NOXRED1, NPAS3, NPC2, NRL, NYNRIN, OSGEP, OTUB2, PABPN1, PAPOLA, PARP2, PAX9, PCK2, PELI2, PIGH, PLD4, PNN, PNP, POLE2, POMT2, PPM1A, PPP1R3E, PPP2R5C, PRKCH, PRKD1, PRMT5, PROX2, PRPF39, PSEN1, PSMA3, PSMA6, PSMB11, PSMB5, PSMC1, PSMC6, PSME1, PSME2, PTGDR, PTGR2, PTPN21, PYGL, RABGGTA, RAD51B, RBM23, RBM25, RCOR1, RDH11, RDH12, REC8, RIPK3, RNASE2, RNASE3, RNASE4, RNASE6, RNF31, RP11-176H8.1, RP11-47I22.4, RPL10L, RPL36AL, RPS29, RPS6KA5, RPS6KL1, SALL2, SEC23A, SERPINA6, SETD3, SGPP1, SIX1, SLC10A1, SLC25A21, SLC7A7, SLC7A8, SLIRP, SMEK1, SNAPC1, SNW1, SOCS4, SPTLC2, SPTSSA, SRP54, SRSF5, STYX, SUPT16H, TBPL2, TDP1, TDRD9, TEP1, TGM1, TIMM9, TINF2, TMED10, TMX1, TRIM9, TRIP11, TRMT61A, TSSK4, TTC5, TTLL5, VCPKMT, VIPAS39, VRK1, VRTN, VSX2, WARS, WDHD1, XRCC3, YLPM1, YY1, ZBTB1, ZBTB25, ZBTB42, ZDHHC22, ZFHX2, ZFP36L1, ZFYVE26, ZNF219, ZNF410"
Randomized tissue pcHi-C,Links w/ 5+ tissues vs Links w/ 1+ tissue,chr14,GO:0006807,BP,e,nitrogen compound metabolic process,240/613,240/676,2.65e-13,2,240,1.06e-10,"ABCD4, ABHD12B, ACIN1, ACOT1, ACOT2, ACOT4, ADAM20, ADAM21, ADCK1, ADCY4, ADSSL1, AJUBA, AK7, AKT1, ALDH6A1, ALKBH1, AMN, ANG, APEX1, AREL1, ARG2, ARID4A, ASB2, ASPG, ATP5S, ATXN3, BATF, BAZ1A, BCL11B, BMP4, BRF1, BRMS1L, C14orf166, CALM1, CCNB1IP1, CCNK, CDC42BPB, CDKL1, CDKN3, CEBPE, CHD8, CHURC1, CHURC1-FNTB, CINP, CKB, CMA1, CPSF2, CTSG, DAD1, DCAF11, DCAF4, DCAF5, DDX24, DEGS2, DICER1, DIO2, DIO3, DLST, DPF3, DTD2, EGLN3, EIF2B2, EIF2S1, EIF5, ELMSAN1, ENTPD5, ERH, ERO1L, ESR2, ESRRB, EXD2, EXOC5, FANCM, FBXO33, FCF1, FKBP3, FNTB, FOS, FOXG1, FOXN3, FSCB, FUT8, G2E3, GALC, GALNT16, GCH1, GEMIN2, GMFB, GMPR2, GNPNAT1, GPHN, GSTZ1, GTF2A1, GZMB, GZMH, HECTD1, HIF1A, HNRNPC, HOMEZ, HSP90AA1, INSM2, IRF9, JAG2, JDP2, JKAMP, KIAA0391, L2HGDH, LGALS3, LGMN, LIN52, LRR1, MAP3K9, MAP4K5, MARK3, MAX, MBIP, MED6, METTL17, METTL3, MGAT2, MLH3, MMP14, MNAT1, MOK, MRPL52, MTHFD1, NEDD8, NEDD8-MDP1, NEK9, NFATC4, NKX2-8, NOVA1, NOXRED1, NPAS3, NRL, NYNRIN, OSGEP, OTUB2, PABPN1, PAPOLA, PARP2, PAX9, PELI2, PIGH, PNN, PNP, POLE2, POMT2, PPM1A, PPP2R5C, PRKCH, PRKD1, PRMT5, PROX2, PRPF39, PSEN1, PSMA3, PSMA6, PSMB11, PSMB5, PSMC1, PSMC6, PSME1, PSME2, PTGDR, PTPN21, RABGGTA, RAD51B, RBM23, RBM25, RCOR1, REC8, RIPK3, RNASE2, RNASE3, RNASE4, RNASE6, RNF31, RP11-176H8.1, RP11-47I22.4, RPL10L, RPL36AL, RPS29, RPS6KA5, RPS6KL1, SALL2, SEC23A, SETD3, SGPP1, SIX1, SLC25A21, SLC7A7, SLC7A8, SLIRP, SMEK1, SNAPC1, SNW1, SOCS4, SPTB, SPTLC2, SPTSSA, SRP54, SRSF5, STYX, SUPT16H, TBPL2, TDP1, TDRD9, TEP1, TGM1, THTPA, TIMM9, TINF2, TMED10, TMX1, TRIM9, TRIP11, TRMT61A, TSSK4, TTC5, TTLL5, VCPKMT, VIPAS39, VRK1, VRTN, VSX2, WARS, WDHD1, XRCC3, YLPM1, YY1, ZBTB1, ZBTB25, ZBTB42, ZDHHC22, ZFHX2, ZFP36L1, ZFYVE26, ZNF219, ZNF410"
Randomized tissue pcHi-C,Links w/ 5+ tissues vs Links w/ 1+ tissue,chr14,GO:0065007,BP,e,biological regulation         ,294/613,297/676,4.99e-13,1,294,1.71e-10,"ACIN1, ACTN1, ADCY4, AHSA1, AJUBA, AKAP5, AKAP6, AKT1, ALKBH1, ANG, APEX1, APOPT1, AREL1, ARF6, ARHGAP5, ARHGEF40, ARID4A, ASB2, ATG14, ATP6V1D, ATXN3, BAG5, BATF, BAZ1A, BCL11B, BCL2L2, BCL2L2-PABPN1, BDKRB1, BDKRB2, BMP4, BRF1, BRMS1L, BTBD7, C14orf166, C14orf39, CALM1, CCDC88C, CCNK, CDC42BPB, CDKN3, CEBPE, CGRRF1, CHD8, CHGA, CHURC1, CHURC1-FNTB, CIDEB, CKB, CLMN, CMA1, CNIH1, COCH, CRIP1, CRIP2, CTAGE5, CTSG, DACT1, DAD1, DHRS2, DICER1, DIO2, DIO3, DLGAP5, DLK1, DPF3, EAPP, EFS, EGLN3, EIF2B2, EIF2S1, EIF5, ELMSAN1, ENTPD5, ERO1L, ESR2, ESRRB, EVL, FBLN5, FERMT2, FITM1, FNTB, FOS, FOXA1, FOXG1, FOXN3, FRMD6, FUT8, G2E3, GCH1, GLRX5, GMFB, GNG2, GPR132, GPR135, GPR65, GPR68, GPX2, GSC, GTF2A1, GZMB, HIF1A, HNRNPC, HOMEZ, HSP90AA1, HSPA2, IFI27, IGHG1, IL25, INF2, INSM2, IRF9, ITPK1, JAG2, JDP2, JPH4, KCNH5, KCNK10, KIAA0586, KIF26A, KLC1, LGMN, LTB4R, LTB4R2, LTBP2, MAP3K9, MAP4K5, MAX, MBIP, MED6, MIA2, MMP14, MNAT1, MOAP1, MOK, MTA1, MYH6, MYH7, NDRG2, NEDD8, NEDD8-MDP1, NFATC4, NFKBIA, NGDN, NKX2-1, NKX2-8, NPAS3, NPC2, NRL, NRXN3, NUMB, OR10G2, OR10G3, OR11G2, OR11H4, OR11H6, OR4E2, OR4K1, OR4K13, OR4K14, OR4K15, OR4K17, OR4K2, OR4K5, OR4L1, OR4M1, OR4N2, OR4N5, OR4Q3, OR5AU1, OR6J1, OR6S1, OTX2, OXA1L, PABPN1, PARP2, PAX9, PCK2, PELI2, PGF, PLEK2, PLEKHG3, PNN, PNP, PPM1A, PPP1R13B, PPP1R36, PPP2R3C, PPP2R5C, PPP2R5E, PPP4R4, PRIMA1, PRKCH, PRKD1, PRMT5, PROX2, PSEN1, PSMA3, PSMA6, PSMB11, PSMB5, PSMC1, PSMC6, PSME1, PSME2, PTGDR, PTGER2, PYGL, RAB15, RAB2B, RAD51B, RALGAPA1, RBM25, RCOR1, RDH11, RDH12, REM2, RGS6, RHOJ, RIN3, RIPK3, RNASE10, RNF31, RPS29, RPS6KA5, RTN1, SALL2, SAMD4A, SAV1, SCFD1, SEL1L, SERPINA1, SERPINA10, SERPINA11, SERPINA12, SERPINA3, SERPINA4, SERPINA5, SERPINA6, SERPINA9, SETD3, SGPP1, SIPA1L1, SIVA1, SIX1, SIX4, SIX6, SLC24A4, SLC7A7, SLC7A8, SLC8A3, SLIRP, SMEK1, SMOC1, SNAPC1, SNW1, SNX6, SOCS4, SOS2, SPTB, SRSF5, SSTR1, STON2, STRN3, SUPT16H, SYNE2, SYNE3, SYNJ2BP, TBPL2, TDRD9, TGFB3, TINF2, TMEM30B, TMX1, TRAF3, TRIM9, TSHR, TSSK4, TTC5, TTC8, TXNDC16, VASH1, VIPAS39, VSX2, WARS, WDHD1, YLPM1, YY1, ZBTB1, ZBTB42, ZFHX2, ZFP36L1, ZFYVE1, ZNF219, ZNF410"
Randomized tissue pcHi-C,Links w/ 5+ tissues vs Links w/ 1+ tissue,chr14,GO:0044237,BP,e,cellular metabolic process    ,229/613,229/676,1.56e-12,2,229,4.98e-10,"ABCD4, ACIN1, ACOT1, ACOT2, ACOT4, ACYP1, ADCK1, ADCY4, ADSSL1, AJUBA, AK7, AKAP5, AKT1, ALDH6A1, ALKBH1, AMN, ANG, APEX1, AREL1, ARG2, ARID4A, ASB2, ASPG, ATG14, ATG2B, ATP5S, ATXN3, BATF, BAZ1A, BCL11B, BMP4, BRF1, BRMS1L, C14orf166, CALM1, CCNK, CDC42BPB, CDKL1, CDKN3, CEBPE, CHD8, CHURC1, CHURC1-FNTB, CINP, CKB, COQ6, CPSF2, CYP46A1, DDX24, DEGS2, DHRS4, DICER1, DIO2, DIO3, DLST, DPF3, DTD2, EIF2B2, EIF2S1, EIF5, ELMSAN1, ENTPD5, ERH, ESR2, ESRRB, EXD2, FANCM, FCF1, FNTB, FOS, FOXG1, FOXN3, FSCB, FUT8, GALC, GCH1, GEMIN2, GMFB, GMPR2, GNG2, GNPNAT1, GPHN, GSTZ1, GTF2A1, HECTD1, HIF1A, HNRNPC, HOMEZ, INSM2, IRF9, ISCA2, ITPK1, JDP2, JKAMP, KIAA0391, L2HGDH, LGALS3, LGMN, LIN52, MAP3K9, MAP4K5, MARK3, MAX, MED6, METTL17, METTL3, MLH3, MNAT1, MOK, MRPL52, MTHFD1, NDUFB1, NEDD8, NEK9, NFATC4, NKX2-1, NKX2-8, NOVA1, NOXRED1, NPAS3, NRL, NYNRIN, OSGEP, OTUB2, OXA1L, PABPN1, PAPOLA, PARP2, PAX9, PCK2, PIGH, PLD4, PNN, PNP, POLE2, PPM1A, PPP1R3E, PPP2R5C, PRIMA1, PRKCH, PRKD1, PRMT5, PROX2, PRPF39, PSEN1, PSMA3, PSMA6, PSMB11, PSMB5, PSMC1, PSMC6, PSME1, PSME2, PTGDR, PTGR2, PTPN21, PYGL, RABGGTA, RAD51B, RBM23, RBM25, RDH11, RDH12, REC8, RIPK3, RNASE2, RNASE3, RNASE4, RNASE6, RP11-176H8.1, RP11-47I22.4, RPL10L, RPL36AL, RPS29, RPS6KA5, RPS6KL1, SALL2, SDR39U1, SETD3, SGPP1, SIX1, SLC10A1, SLC25A21, SLC7A7, SLC7A8, SLIRP, SMEK1, SNAPC1, SNW1, SPTB, SPTLC2, SPTSSA, SRP54, SRSF5, STYX, SUPT16H, TBPL2, TDP1, TDRD9, TECPR2, TEP1, THTPA, TINF2, TM9SF1, TMX1, TRIM9, TRIP11, TRMT61A, TSSK4, TTC5, TTLL5, VCPKMT, VIPAS39, VRK1, VRTN, VSX2, WARS, WDHD1, XRCC3, YLPM1, YY1, ZBTB1, ZBTB25, ZBTB42, ZFHX2, ZFP36L1, ZFYVE26, ZNF219, ZNF410"
Randomized tissue pcHi-C,Links w/ 5+ tissues vs Links w/ 1+ tissue,chr14,GO:0050789,BP,e,regulation of biological process,277/613,280/676,8.76e-12,2,277,2.62e-09,"ACIN1, ACTN1, ADCY4, AJUBA, AKAP5, AKAP6, AKT1, ALKBH1, ANG, APEX1, APOPT1, AREL1, ARF6, ARHGAP5, ARHGEF40, ARID4A, ASB2, ATG14, ATP6V1D, ATXN3, BAG5, BATF, BAZ1A, BCL11B, BCL2L2, BCL2L2-PABPN1, BDKRB1, BDKRB2, BMP4, BRF1, BRMS1L, BTBD7, C14orf166, C14orf39, CALM1, CCDC88C, CCNK, CDC42BPB, CDKN3, CEBPE, CGRRF1, CHD8, CHURC1, CHURC1-FNTB, CIDEB, CLMN, CMA1, CNIH1, COCH, CRIP1, CRIP2, CTSG, DACT1, DAD1, DHRS2, DICER1, DIO2, DIO3, DLGAP5, DLK1, DPF3, EAPP, EFS, EGLN3, EIF2B2, EIF2S1, EIF5, ELMSAN1, ENTPD5, ERO1L, ESR2, ESRRB, EVL, FBLN5, FERMT2, FITM1, FNTB, FOS, FOXA1, FOXG1, FOXN3, FRMD6, FUT8, G2E3, GMFB, GNG2, GPR132, GPR135, GPR65, GPR68, GPX2, GSC, GTF2A1, GZMB, HIF1A, HNRNPC, HOMEZ, HSP90AA1, HSPA2, IFI27, IGHG1, IL25, INF2, INSM2, IRF9, ITPK1, JAG2, JDP2, JPH4, KCNH5, KCNK10, KIAA0586, KIF26A, LGMN, LTB4R, LTB4R2, LTBP2, MAP3K9, MAP4K5, MAX, MBIP, MED6, MMP14, MNAT1, MOAP1, MOK, MTA1, MYH6, MYH7, NDRG2, NEDD8, NEDD8-MDP1, NFATC4, NFKBIA, NGDN, NKX2-1, NKX2-8, NPAS3, NPC2, NRL, NRXN3, NUMB, OR10G2, OR10G3, OR11G2, OR11H4, OR11H6, OR4E2, OR4K1, OR4K13, OR4K14, OR4K15, OR4K17, OR4K2, OR4K5, OR4L1, OR4M1, OR4N2, OR4N5, OR4Q3, OR5AU1, OR6J1, OR6S1, OTX2, PABPN1, PARP2, PAX9, PCK2, PELI2, PGF, PLEK2, PLEKHG3, PNN, PNP, PPM1A, PPP1R13B, PPP1R36, PPP2R3C, PPP2R5C, PPP2R5E, PPP4R4, PRKCH, PRKD1, PRMT5, PROX2, PSEN1, PSMA3, PSMA6, PSMB11, PSMB5, PSMC1, PSMC6, PSME1, PSME2, PTGDR, PTGER2, RAB15, RAB2B, RALGAPA1, RBM25, RCOR1, RDH11, RDH12, REM2, RGS6, RHOJ, RIN3, RIPK3, RNASE10, RNF31, RPS29, RPS6KA5, RTN1, SALL2, SAMD4A, SAV1, SCFD1, SEL1L, SERPINA1, SERPINA10, SERPINA11, SERPINA12, SERPINA3, SERPINA4, SERPINA5, SERPINA6, SERPINA9, SETD3, SGPP1, SIPA1L1, SIVA1, SIX1, SIX4, SIX6, SLIRP, SMEK1, SMOC1, SNAPC1, SNW1, SNX6, SOCS4, SOS2, SPTB, SRSF5, SSTR1, STON2, STRN3, SUPT16H, SYNE2, SYNE3, SYNJ2BP, TBPL2, TDRD9, TGFB3, TINF2, TMEM30B, TMX1, TRAF3, TRIM9, TSHR, TSSK4, TTC5, TTC8, VASH1, VIPAS39, VSX2, WARS, WDHD1, YLPM1, YY1, ZBTB1, ZBTB42, ZFHX2, ZFP36L1, ZFYVE1, ZNF219, ZNF410"
Randomized tissue pcHi-C,Links w/ 5+ tissues vs Links w/ 1+ tissue,chr14,GO:0043170,BP,e,macromolecule metabolic process,206/613,206/676,4.25e-11,3,206,1.2e-08,"ABHD12B, ACIN1, ADAM20, ADAM21, ADCK1, AJUBA, AKT1, ALKBH1, AMN, ANG, APEX1, AREL1, ARID4A, ASB2, ATXN3, BATF, BAZ1A, BCL11B, BMP4, BRF1, BRMS1L, C14orf166, CALM1, CCNB1IP1, CCNK, CDC42BPB, CDKL1, CDKN3, CEBPE, CHD8, CHURC1, CHURC1-FNTB, CINP, CMA1, CPSF2, CTSG, DAD1, DCAF11, DCAF4, DCAF5, DDX24, DICER1, DIO2, DPF3, EGLN3, EIF2B2, EIF2S1, EIF5, ELMSAN1, ENTPD5, ERO1L, ESR2, ESRRB, EXOC5, FANCM, FBXO33, FCF1, FKBP3, FNTB, FOS, FOXG1, FOXN3, FSCB, FUT8, G2E3, GALNT16, GEMIN2, GMFB, GNPNAT1, GTF2A1, GZMB, GZMH, HECTD1, HIF1A, HNRNPC, HOMEZ, INSM2, IRF9, JAG2, JDP2, JKAMP, KIAA0391, L2HGDH, LGALS3, LGMN, LIN52, LRR1, MAP3K9, MAP4K5, MARK3, MAX, MBIP, MED6, METTL17, METTL3, MGAT2, MLH3, MMP14, MNAT1, MOK, MRPL52, NEDD8, NEDD8-MDP1, NEK9, NFATC4, NKX2-8, NOVA1, NPAS3, NRL, NYNRIN, OSGEP, OTUB2, PABPN1, PAPOLA, PARP2, PAX9, PELI2, PIGH, PNN, PNP, POLE2, POMT2, PPM1A, PPP1R3E, PPP2R5C, PRKCH, PRKD1, PRMT5, PROX2, PRPF39, PSEN1, PSMA3, PSMA6, PSMB11, PSMB5, PSMC1, PSMC6, PSME1, PSME2, PTPN21, PYGL, RABGGTA, RAD51B, RBM23, RBM25, RCOR1, REC8, RIPK3, RNASE2, RNASE3, RNASE4, RNASE6, RNF31, RP11-47I22.4, RPL10L, RPL36AL, RPS29, RPS6KA5, RPS6KL1, SALL2, SEC23A, SETD3, SIX1, SLIRP, SMEK1, SNAPC1, SNW1, SOCS4, SRP54, SRSF5, STYX, SUPT16H, TBPL2, TDP1, TDRD9, TEP1, TGM1, TIMM9, TINF2, TMED10, TMX1, TRIM9, TRIP11, TRMT61A, TSSK4, TTC5, TTLL5, VCPKMT, VIPAS39, VRK1, VRTN, VSX2, WARS, WDHD1, XRCC3, YLPM1, YY1, ZBTB1, ZBTB25, ZBTB42, ZDHHC22, ZFHX2, ZFP36L1, ZFYVE26, ZNF219, ZNF410"
Randomized tissue pcHi-C,Links w/ 5+ tissues vs Links w/ 1+ tissue,chr14,GO:0050794,BP,e,regulation of cellular process,256/613,259/676,2.9e-10,3,256,7.32e-08,"ACIN1, ACTN1, ADCY4, AJUBA, AKAP5, AKAP6, AKT1, ALKBH1, ANG, APEX1, APOPT1, AREL1, ARF6, ARHGAP5, ARHGEF40, ARID4A, ASB2, ATG14, ATP6V1D, ATXN3, BAG5, BATF, BAZ1A, BCL11B, BCL2L2, BCL2L2-PABPN1, BDKRB1, BDKRB2, BMP4, BRF1, BRMS1L, C14orf166, C14orf39, CALM1, CCDC88C, CCNK, CDC42BPB, CDKN3, CEBPE, CGRRF1, CHD8, CHURC1, CHURC1-FNTB, CIDEB, CLMN, CNIH1, CRIP1, CRIP2, DACT1, DAD1, DHRS2, DICER1, DIO2, DLGAP5, DLK1, DPF3, EAPP, EFS, EGLN3, EIF2B2, EIF2S1, EIF5, ELMSAN1, ENTPD5, ERO1L, ESR2, ESRRB, EVL, FBLN5, FERMT2, FNTB, FOS, FOXA1, FOXG1, FOXN3, FRMD6, FUT8, G2E3, GMFB, GNG2, GPR132, GPR135, GPR65, GPR68, GSC, GTF2A1, GZMB, HIF1A, HNRNPC, HOMEZ, HSP90AA1, HSPA2, IFI27, IGHG1, IL25, INF2, INSM2, IRF9, ITPK1, JAG2, JDP2, JPH4, KCNH5, KCNK10, KIAA0586, KIF26A, LGMN, LTB4R, LTB4R2, LTBP2, MAP3K9, MAP4K5, MAX, MBIP, MED6, MMP14, MNAT1, MOK, MTA1, MYH6, NDRG2, NEDD8, NEDD8-MDP1, NFATC4, NFKBIA, NGDN, NKX2-1, NKX2-8, NPAS3, NPC2, NRL, NRXN3, NUMB, OR10G2, OR10G3, OR11G2, OR11H4, OR11H6, OR4E2, OR4K1, OR4K13, OR4K14, OR4K15, OR4K17, OR4K2, OR4K5, OR4L1, OR4M1, OR4N2, OR4N5, OR4Q3, OR5AU1, OR6J1, OR6S1, OTX2, PABPN1, PARP2, PAX9, PCK2, PELI2, PGF, PLEK2, PLEKHG3, PNN, PNP, PPM1A, PPP1R13B, PPP1R36, PPP2R3C, PPP2R5C, PPP2R5E, PPP4R4, PRKCH, PRKD1, PRMT5, PROX2, PSEN1, PSMA3, PSMA6, PSMB11, PSMB5, PSMC1, PSMC6, PSME1, PSME2, PTGDR, PTGER2, RAB15, RAB2B, RALGAPA1, RBM25, RCOR1, RDH11, RDH12, REM2, RGS6, RHOJ, RIN3, RIPK3, RNASE10, RNF31, RPS6KA5, RTN1, SALL2, SAMD4A, SAV1, SCFD1, SEL1L, SETD3, SGPP1, SIPA1L1, SIVA1, SIX1, SIX4, SIX6, SLIRP, SMEK1, SMOC1, SNAPC1, SNW1, SNX6, SOCS4, SOS2, SPTB, SRSF5, SSTR1, STON2, STRN3, SUPT16H, SYNE2, SYNJ2BP, TBPL2, TGFB3, TINF2, TMEM30B, TMX1, TRAF3, TRIM9, TSHR, TSSK4, TTC5, TTC8, VASH1, VIPAS39, VSX2, WARS, WDHD1, YLPM1, YY1, ZBTB1, ZBTB42, ZFHX2, ZFP36L1, ZFYVE1, ZNF219, ZNF410"
Randomized tissue pcHi-C,Links w/ 5+ tissues vs Links w/ 1+ tissue,chr14,GO:0019222,BP,e,regulation of metabolic process,154/613,154/676,4.68e-08,3,154,8.62e-06,"ACIN1, ADCY4, AJUBA, AKAP6, AKT1, ALKBH1, ANG, APEX1, APOPT1, ARID4A, ATG14, ATXN3, BAG5, BATF, BAZ1A, BCL11B, BDKRB1, BDKRB2, BMP4, BRF1, BRMS1L, C14orf166, C14orf39, CALM1, CCDC88C, CCNK, CDKN3, CEBPE, CHD8, CHURC1, CHURC1-FNTB, CRIP1, DACT1, DICER1, DIO2, DPF3, EAPP, EGLN3, EIF2B2, EIF2S1, EIF5, ELMSAN1, ESR2, ESRRB, FBLN5, FNTB, FOS, FOXA1, FOXG1, FOXN3, GMFB, GSC, GTF2A1, HIF1A, HOMEZ, HSP90AA1, HSPA2, IFI27, IL25, INSM2, IRF9, JDP2, KCNH5, MAP3K9, MAX, MED6, MMP14, MNAT1, MOAP1, MTA1, NDRG2, NEDD8, NEDD8-MDP1, NFATC4, NFKBIA, NGDN, NKX2-1, NKX2-8, NPAS3, NPC2, NRL, OTX2, PABPN1, PAX9, PELI2, PNN, PPM1A, PPP1R36, PPP2R3C, PPP4R4, PRKCH, PRKD1, PRMT5, PROX2, PSEN1, PSMA3, PSMA6, PSMB11, PSMB5, PSMC1, PSMC6, PSME1, PSME2, RALGAPA1, RBM25, RCOR1, RIPK3, RNF31, RPS29, RPS6KA5, SALL2, SAMD4A, SERPINA1, SERPINA10, SERPINA11, SERPINA12, SERPINA3, SERPINA4, SERPINA5, SERPINA6, SERPINA9, SETD3, SIVA1, SIX1, SIX4, SIX6, SLIRP, SMEK1, SNAPC1, SNW1, SNX6, SOCS4, STRN3, SUPT16H, TBPL2, TDRD9, TGFB3, TINF2, TMX1, TRAF3, TSSK4, TTC5, VASH1, VIPAS39, VSX2, YLPM1, YY1, ZBTB1, ZBTB42, ZFHX2, ZFP36L1, ZFYVE1, ZNF219, ZNF410"
Randomized tissue pcHi-C,Links w/ 5+ tissues vs Links w/ 1+ tissue,chr14,GO:0034641,BP,e,cellular nitrogen compound metabolic process,153/613,153/676,4.91e-08,3,153,8.71e-06,"ACIN1, ACOT1, ACOT2, ACOT4, ADCY4, ADSSL1, AJUBA, AK7, AKT1, ALDH6A1, ALKBH1, ANG, APEX1, ARG2, ARID4A, ATP5S, ATXN3, BATF, BAZ1A, BCL11B, BRF1, BRMS1L, C14orf166, CCNK, CEBPE, CHD8, CHURC1, CINP, CKB, CPSF2, DDX24, DEGS2, DICER1, DIO2, DIO3, DLST, DPF3, EIF2B2, EIF2S1, EIF5, ELMSAN1, ENTPD5, ERH, ESR2, ESRRB, EXD2, FANCM, FCF1, FOS, FOXG1, FOXN3, FUT8, GCH1, GEMIN2, GMPR2, GNPNAT1, GSTZ1, GTF2A1, HIF1A, HNRNPC, HOMEZ, INSM2, IRF9, JDP2, KIAA0391, LGALS3, LIN52, MAP3K9, MAX, MED6, METTL17, METTL3, MLH3, MNAT1, MRPL52, MTHFD1, NFATC4, NKX2-8, NOVA1, NPAS3, NRL, NYNRIN, OSGEP, PABPN1, PAPOLA, PARP2, PAX9, PNN, PNP, POLE2, PPM1A, PRMT5, PROX2, PRPF39, PSMA3, PSMA6, PSMB11, PSMB5, PSMC1, PSMC6, PSME1, PSME2, PTGDR, RAD51B, RBM23, RBM25, REC8, RNASE2, RNASE3, RNASE4, RNASE6, RPL10L, RPL36AL, RPS29, SALL2, SETD3, SIX1, SLC25A21, SLIRP, SNAPC1, SNW1, SPTB, SPTLC2, SRP54, SRSF5, SUPT16H, TBPL2, TDP1, TDRD9, TEP1, THTPA, TINF2, TMX1, TRIP11, TRMT61A, TTC5, TTLL5, VIPAS39, VRTN, VSX2, WARS, WDHD1, XRCC3, YLPM1, YY1, ZBTB1, ZBTB25, ZBTB42, ZFHX2, ZFP36L1, ZFYVE26, ZNF219, ZNF410"
Randomized tissue pcHi-C,Links w/ 5+ tissues vs Links w/ 1+ tissue,chr14,GO:1901360,BP,e,organic cyclic compound metabolic process,151/613,151/676,8.48e-08,3,151,1.45e-05,"ABCD4, ACIN1, ACOT1, ACOT2, ACOT4, ADCY4, ADSSL1, AJUBA, AK7, AKT1, ALDH6A1, ALKBH1, AMN, ANG, APEX1, ARID4A, ATP5S, ATXN3, BATF, BAZ1A, BCL11B, BRF1, BRMS1L, C14orf1, C14orf166, CCNK, CEBPE, CHD8, CHURC1, CINP, CPSF2, CYP46A1, DDX24, DHRS2, DHRS4, DICER1, DIO2, DIO3, DLST, DPF3, ELMSAN1, ENTPD5, ERH, ESR2, ESRRB, EXD2, FANCM, FCF1, FOS, FOXG1, FOXN3, FUT8, GCH1, GEMIN2, GMPR2, GNPNAT1, GPHN, GSTZ1, GTF2A1, HIF1A, HNRNPC, HOMEZ, INSM2, IRF9, JDP2, KIAA0391, LGALS3, LGMN, LIN52, MAP3K9, MAX, MED6, METTL3, MLH3, MNAT1, MTHFD1, NFATC4, NKX2-8, NOVA1, NPAS3, NPC2, NRL, NYNRIN, OSGEP, PABPN1, PAPOLA, PARP2, PAX9, PNN, PNP, POLE2, PPM1A, PRMT5, PROX2, PRPF39, PSMA3, PSMA6, PSMB11, PSMB5, PSMC1, PSMC6, PSME1, PSME2, PTGDR, RAD51B, RBM23, RBM25, REC8, RNASE2, RNASE3, RNASE4, RNASE6, RPS29, SALL2, SERPINA6, SETD3, SIX1, SLC10A1, SLIRP, SNAPC1, SNW1, SPTB, SRSF5, SUPT16H, TBPL2, TDP1, TDRD9, TEP1, THTPA, TINF2, TMX1, TRIP11, TRMT61A, TTC5, TTLL5, VIPAS39, VRTN, VSX2, WARS, WDHD1, XRCC3, YLPM1, YY1, ZBTB1, ZBTB25, ZBTB42, ZFHX2, ZFP36L1, ZFYVE26, ZNF219, ZNF410"
