DS,What,chr,GO,NS,enrichment,name,ratio_in_study,ratio_in_pop,p_uncorrected,depth,study_count,p_fdr_bh,study_items
Randomized tissue pcHi-C,Links w/ 5+ tissues vs Links w/ 1+ tissue,chr2,GO:0008152,BP,e,metabolic process             ,568/1136,570/1188,1.11e-12,1,568,9.87e-10,"AAK1, ABCB11, ABCB6, ABCG5, ABCG8, ABI2, ACADL, ACMSD, ACOXL, ACSL3, ACVR1, ACVR1C, ACVR2A, ACYP2, ADAM17, ADAM23, ADCY3, ADI1, AFF3, AGBL5, AGPS, AGXT, ALK, ALLC, ALPI, ALPP, ALPPL2, ALS2, ANAPC1, ANKRD23, AOX1, APLF, APOB, ARID5A, ASB1, ASB18, ASB3, ASNSD1, ASPRV1, ASTL, ASXL2, ATF2, ATG4B, ATG9A, ATIC, ATOH8, ATP5G3, ATP6V1B1, B3GALT1, B3GNT2, B3GNT7, BARD1, BAZ2B, BCL11A, BIRC6, BMP10, BMPR2, BRE, BUB1, BZW1, C1D, C2orf40, CACNB4, CAD, CALCRL, CALM2, CAPN10, CAPN13, CAPN14, CARF, CASP10, CASP8, CCDC88A, CCNT2, CCT4, CCT7, CD28, CDCA7, CDK15, CDKL4, CEBPZ, CERS6, CFLAR, CHPF, CHST10, CIAO1, CIR1, CLK1, CMPK2, CNNM3, CNOT11, COL3A1, COL4A3, COL4A4, COL5A2, COL6A3, COPS7B, COPS8, COX5B, COX7A2L, CPO, CPS1, CPSF3, CREB1, CSRNP3, CTDSP1, CUL3, CWC22, CYP1B1, CYP26B1, CYP27A1, D2HGDH, DARS, DBI, DCAF17, DCTN1, DDX1, DGKD, DGUOK, DHRS9, DIS3L2, DNAJB2, DNAJC10, DNER, DNMT3A, DNPEP, DPP10, DPP4, DPY30, DPYSL5, DTYMK, DUSP11, DUSP19, DUSP2, DUSP28, E2F6, ECEL1, EEF1B2, EFEMP1, EGR4, EIF2AK2, EIF2AK3, EIF2B4, EIF4E2, EIF5B, EPAS1, EPC2, EPHA4, EPT1, ERBB4, ERCC3, ERLEC1, EVA1A, FABP1, FAHD2A, FAHD2B, FANCL, FAP, FARSB, FASTKD1, FASTKD2, FBXO11, FEV, FHL2, FIGLA, FKBP1B, FKBP7, FN1, FOSL2, FOXN2, FTCDNL1, G6PC2, GAD1, GAL3ST2, GALM, GALNT13, GALNT14, GALNT3, GALNT5, GBX2, GCFC2, GCG, GCKR, GDF7, GEMIN6, GEN1, GFPT1, GGCX, GIGYF2, GLB1L, GLI2, GLS, GMPPA, GPAT2, GPC1, GPD2, GPR75-ASB3, GRHL1, GTDC1, GTF2A1L, GTF3C2, GTF3C3, HAAO, HADHA, HADHB, HAT1, HDAC4, HDLBP, HECW2, HES6, HIBCH, HK2, HNRNPA3, HNRNPLL, HOXD1, HOXD10, HOXD11, HOXD12, HOXD13, HOXD3, HOXD4, HOXD8, HOXD9, HS6ST1, HSPD1, HTR2B, HTRA2, IAH1, ID2, IDH1, IFIH1, IFT172, IGFBP2, IGFBP5, IHH, IKZF2, IL1B, IL1RN, ILKAP, IMP4, ING5, INHA, INO80B, INO80D, INPP1, INPP4A, INPP5D, INSIG2, IRS1, ITGB1BP1, IWS1, KANSL3, KCNIP3, KCNS3, KDM3A, KHK, KLF11, KLF7, KLHL41, KYNU, LBH, LBX2, LCLAT1, LCT, LIPT1, LONRF2, LPIN1, LRP2, LRPPRC, LRRFIP1, LYG1, LYG2, M1AP, MAP2, MAP3K19, MAP3K2, MAP4K3, MAP4K4, MARCH7, MARS2, MAT2A, MBOAT2, MCEE, MCFD2, MCM6, MDH1, MDH1B, MERTK, METAP1D, METTL21A, METTL5, METTL8, MGAT4A, MGAT5, MLTK, MMADHC, MOGAT1, MOGS, MPHOSPH10, MPV17, MRPL19, MRPL33, MRPL35, MRPL44, MRPS5, MRPS9, MSGN1, MSH2, MSH6, MTERFD2, MTHFD2, MTX2, MXD1, MYO3B, MYT1L, NAB1, NABP1, NAGK, NCOA1, NDUFA10, NDUFAF7, NDUFB3, NDUFS1, NEU2, NEU4, NFE2L2, NFU1, NHEJ1, NIF3L1, NIFK, NLRC4, NMI, NOP58, NOSTRIN, NOTO, NPAS2, NPPC, NR4A2, NRBP1, NT5C1B, NT5C1B-RDH14, NUP35, ODC1, ORC2, ORC4, ORMDL1, OSGEPL1, OSR1, PAPOLG, PASK, PAX3, PAX8, PCBP1, PCGF1, PCYOX1, PDE11A, PDE1A, PDIA6, PDK1, PECR, PELI1, PER2, PEX13, PGAP1, PHOSPHO2, PID1, PIGF, PIKFYVE, PKDCC, PLA2R1, PLB1, PLCD4, PLCL1, PLEK, PMS1, PNKD, PNPT1, POLE4, POLR1A, POLR1B, POLR2D, POMC, POU3F3, PPIG, PPIL3, PPM1B, PPM1G, PPP1CB, PREB, PREPL, PRKAG3, PRKCE, PRKD3, PRKRA, PRLH, PROC, PRPF40A, PRSS56, PSMD1, PSMD14, PSME4, PTCD3, PTMA, PTPN18, PTPN4, PTPRN, PUS10, PXDN, QPCT, RAB1A, RANBP2, RAPGEF4, RBKS, RBMS1, RDH14, REL, RETSAT, REV1, RFX8, RHBDD1, RNASEH1, RNF103, RNF144A, RNF149, RNF181, RNF25, RNPEPL1, ROCK2, RPE, RPIA, RPL31, RPL37A, RPS27A, RPS7, RQCD1, RRM2, SAP130, SATB2, SCLY, SCRN3, SDC1, SERTAD2, SF3B1, SF3B14, SFTPB, SGPP2, SH3YL1, SLC11A1, SLC19A3, SLC20A1, SLC25A12, SLC30A6, SLC3A1, SLC5A6, SLC5A7, SMARCAL1, SMC6, SMEK2, SMPD4, SMYD1, SNRNP200, SNRNP27, SNRPG, SNX17, SOCS5, SOX11, SP100, SP110, SP5, SP9, SPAST, SPEG, SPOPL, SPR, SPTBN1, SRBD1, SRSF7, SSB, ST3GAL5, ST6GAL2, STAMBP, STAT1, STAT4, STK16, STK17B, STK25, STK36, STK39, STON1-GTF2A1L, STRADB, SUCLG1, SULT1C2, SULT1C3, SULT1C4, SUMO1, SUPT7L, TAF1B, TBR1, TCF7L1, TET3, TFCP2L1, TFPI, THNSL2, THUMPD2, TLK1, TLX2, TMEM150A, TMEM18, TNP1, TP53I3, TPO, TPRKB, TRABD2A, TRAK2, TRIB2, TRIM54, TRIP12, TRMT61B, TSN, TTL, TTLL4, TTN, TUBA3D, TUBA4A, TWIST2, TYW5, UBE2E3, UBE2F, UBR3, UCN, UGGT1, UGP2, UGT1A1, UGT1A10, UGT1A3, UGT1A4, UGT1A5, UGT1A6, UGT1A7, UGT1A8, UGT1A9, UPP2, USP34, USP37, USP39, USP40, UXS1, VAX2, VRK2, WDR12, WDR33, WDR92, WDSUB1, XDH, XPO1, XRCC5, ZAP70, ZC3H8, ZEB2, ZFP36L2, ZNF142, ZNF2, ZNF512, ZNF513, ZNF514, ZNF638, ZRANB3, ZSWIM2"
Randomized tissue pcHi-C,Links w/ 5+ tissues vs Links w/ 1+ tissue,chr2,GO:0044237,BP,e,cellular metabolic process    ,451/1136,451/1188,1.01e-11,2,451,7.16e-09,"AAK1, ABCB11, ABCB6, ABI2, ACADL, ACMSD, ACOXL, ACSL3, ACVR1, ACVR1C, ACVR2A, ACYP2, ADCY3, ADI1, AFF3, AGPS, AGXT, ALK, ALLC, ALPI, ALPPL2, ALS2, ANAPC1, ANKRD23, AOX1, APLF, APOB, ARID5A, ASNSD1, ASXL2, ATF2, ATG4B, ATG9A, ATIC, ATOH8, ATP5G3, ATP6V1B1, B3GALT1, B3GNT2, B3GNT7, BARD1, BAZ2B, BCL11A, BIRC6, BMP10, BMPR2, BRE, BUB1, BZW1, C1D, C2orf40, CACNB4, CAD, CALCRL, CALM2, CARF, CCDC88A, CCNT2, CDCA7, CDK15, CDKL4, CEBPZ, CERS6, CHPF, CIAO1, CIR1, CLK1, CMPK2, CNNM3, CNOT11, COX5B, COX7A2L, CPS1, CPSF3, CREB1, CSRNP3, CTDSP1, CUL3, CWC22, CYP1B1, CYP26B1, CYP27A1, D2HGDH, DARS, DBI, DDX1, DGKD, DGUOK, DHRS9, DIS3L2, DNAJB2, DNAJC10, DNMT3A, DPY30, DPYSL5, DTYMK, DUSP11, DUSP19, DUSP2, DUSP28, E2F6, EEF1B2, EFEMP1, EGR4, EIF2AK2, EIF2AK3, EIF2B4, EIF4E2, EIF5B, EPAS1, EPC2, EPHA4, EPT1, ERBB4, ERCC3, ERLEC1, EVA1A, FABP1, FANCL, FARSB, FASTKD1, FASTKD2, FBXO11, FEV, FHL2, FIGLA, FOSL2, FOXN2, GAD1, GBX2, GCFC2, GCG, GCKR, GDF7, GEMIN6, GEN1, GFPT1, GLI2, GLS, GMPPA, GPAT2, GPC1, GPD2, GRHL1, GTF2A1L, GTF3C2, GTF3C3, HAAO, HADHA, HADHB, HDAC4, HECW2, HES6, HIBCH, HK2, HNRNPA3, HNRNPLL, HOXD1, HOXD10, HOXD11, HOXD12, HOXD13, HOXD3, HOXD4, HOXD8, HOXD9, HS6ST1, HSPD1, HTR2B, HTRA2, ID2, IDH1, IHH, IKZF2, IL1RN, ILKAP, IMP4, ING5, INHA, INO80B, INO80D, INPP1, INPP4A, INPP5D, INSIG2, ITGB1BP1, IWS1, KCNIP3, KCNS3, KDM3A, KLF11, KLF7, KYNU, LBH, LBX2, LCLAT1, LPIN1, LRP2, LRPPRC, LRRFIP1, LYG1, LYG2, M1AP, MAP2, MAP3K19, MAP3K2, MAP4K3, MAP4K4, MARS2, MAT2A, MBOAT2, MCEE, MCM6, MDH1, MDH1B, MERTK, METTL21A, METTL5, MGAT4A, MLTK, MMADHC, MOGAT1, MPHOSPH10, MPV17, MRPL19, MRPL33, MRPL35, MRPL44, MRPS5, MRPS9, MSGN1, MSH2, MSH6, MTERFD2, MTHFD2, MXD1, MYO3B, MYT1L, NAB1, NABP1, NAGK, NCOA1, NDUFA10, NDUFB3, NDUFS1, NEU2, NEU4, NFE2L2, NFU1, NHEJ1, NIF3L1, NIFK, NMI, NOP58, NOTO, NPAS2, NPPC, NR4A2, NRBP1, NT5C1B, NT5C1B-RDH14, ODC1, ORC2, ORC4, ORMDL1, OSGEPL1, OSR1, PAPOLG, PASK, PAX3, PAX8, PCBP1, PCGF1, PCYOX1, PDE11A, PDE1A, PDK1, PECR, PER2, PEX13, PGAP1, PID1, PIGF, PIKFYVE, PKDCC, PLA2R1, PLB1, PLCD4, PLEK, PMS1, PNKD, PNPT1, POLR1A, POLR1B, POLR2D, POMC, POU3F3, PPIG, PPIL3, PPM1B, PPM1G, PPP1CB, PREB, PRKAG3, PRKCE, PRKD3, PRKRA, PRLH, PRPF40A, PSMD1, PSMD14, PSME4, PTCD3, PTMA, PTPN18, PTPN4, PTPRN, PUS10, PXDN, RAB1A, RAPGEF4, RBMS1, RDH14, REL, RETSAT, REV1, RFX8, RHBDD1, RNASEH1, RNF103, RNPEPL1, ROCK2, RPE, RPIA, RPL31, RPL37A, RPS27A, RPS7, RQCD1, RRM2, SAP130, SATB2, SCLY, SDC1, SERTAD2, SF3B1, SF3B14, SFTPB, SGPP2, SH3YL1, SLC19A3, SLC20A1, SLC3A1, SLC5A6, SLC5A7, SMARCAL1, SMC6, SMEK2, SMPD4, SMYD1, SNRNP200, SNRNP27, SNRPG, SOX11, SP100, SP110, SP5, SP9, SPAST, SPEG, SPOPL, SPR, SPTBN1, SRBD1, SRSF7, SSB, ST3GAL5, STAT1, STAT4, STK16, STK17B, STK25, STK36, STK39, STON1-GTF2A1L, STRADB, SUCLG1, SULT1C2, SULT1C3, SULT1C4, SUMO1, SUPT7L, TAF1B, TBR1, TCF7L1, TET3, TFCP2L1, THNSL2, TLK1, TLX2, TMEM18, TNP1, TP53I3, TPO, TPRKB, TRIB2, TRIM54, TRIP12, TRMT61B, TSN, TTN, TWIST2, TYW5, UBR3, UCN, UGGT1, UGP2, UGT1A1, UGT1A10, UGT1A3, UGT1A4, UGT1A5, UGT1A6, UGT1A7, UGT1A8, UGT1A9, UPP2, USP34, USP37, USP39, USP40, UXS1, VAX2, VRK2, WDR12, WDR33, WDR92, XDH, XPO1, XRCC5, ZAP70, ZC3H8, ZEB2, ZFP36L2, ZNF142, ZNF2, ZNF512, ZNF513, ZNF514, ZNF638, ZRANB3"
Randomized tissue pcHi-C,Links w/ 5+ tissues vs Links w/ 1+ tissue,chr2,GO:0071704,BP,e,organic substance metabolic process,528/1136,530/1188,3.85e-11,2,528,2.49e-08,"AAK1, ABCB11, ABCB6, ABI2, ACADL, ACMSD, ACOXL, ACSL3, ACVR1, ACVR1C, ACVR2A, ADAM17, ADAM23, ADCY3, ADI1, AFF3, AGBL5, AGPS, AGXT, ALK, ALLC, ALS2, ANAPC1, ANKRD23, AOX1, APLF, APOB, ARID5A, ASB1, ASB18, ASB3, ASNSD1, ASPRV1, ASTL, ASXL2, ATF2, ATG4B, ATIC, ATOH8, ATP5G3, ATP6V1B1, B3GALT1, B3GNT2, B3GNT7, BARD1, BAZ2B, BCL11A, BIRC6, BMP10, BMPR2, BRE, BUB1, BZW1, C1D, C2orf40, CACNB4, CAD, CALCRL, CALM2, CAPN10, CAPN13, CAPN14, CARF, CASP10, CASP8, CCDC88A, CCNT2, CCT4, CCT7, CD28, CDCA7, CDK15, CDKL4, CEBPZ, CERS6, CFLAR, CHPF, CHST10, CIR1, CLK1, CMPK2, CNNM3, CNOT11, COL3A1, COPS7B, COPS8, CPO, CPS1, CPSF3, CREB1, CSRNP3, CTDSP1, CUL3, CWC22, CYP1B1, CYP26B1, CYP27A1, D2HGDH, DARS, DBI, DCAF17, DCTN1, DDX1, DGKD, DGUOK, DHRS9, DIS3L2, DNAJB2, DNAJC10, DNER, DNMT3A, DNPEP, DPP10, DPP4, DPY30, DPYSL5, DTYMK, DUSP11, DUSP19, DUSP2, DUSP28, E2F6, ECEL1, EEF1B2, EFEMP1, EGR4, EIF2AK2, EIF2AK3, EIF2B4, EIF5B, EPAS1, EPC2, EPHA4, EPT1, ERBB4, ERCC3, ERLEC1, FABP1, FANCL, FAP, FARSB, FBXO11, FEV, FHL2, FIGLA, FKBP1B, FKBP7, FN1, FOSL2, FOXN2, G6PC2, GAD1, GALM, GALNT13, GALNT14, GALNT3, GALNT5, GBX2, GCFC2, GCG, GCKR, GDF7, GEMIN6, GEN1, GFPT1, GGCX, GIGYF2, GLB1L, GLI2, GLS, GMPPA, GPAT2, GPC1, GPD2, GPR75-ASB3, GRHL1, GTF2A1L, GTF3C2, GTF3C3, HAAO, HADHA, HADHB, HAT1, HDAC4, HDLBP, HECW2, HES6, HIBCH, HK2, HNRNPA3, HNRNPLL, HOXD1, HOXD10, HOXD11, HOXD12, HOXD13, HOXD3, HOXD4, HOXD8, HOXD9, HS6ST1, HSPD1, HTR2B, HTRA2, IAH1, IDH1, IFIH1, IFT172, IGFBP2, IGFBP5, IHH, IKZF2, IL1B, IL1RN, ILKAP, IMP4, ING5, INHA, INO80B, INO80D, INPP1, INPP4A, INPP5D, INSIG2, IRS1, ITGB1BP1, IWS1, KANSL3, KCNIP3, KDM3A, KHK, KLF11, KLF7, KLHL41, KYNU, LBH, LBX2, LCLAT1, LCT, LIPT1, LONRF2, LPIN1, LRP2, LRPPRC, LRRFIP1, LYG1, LYG2, M1AP, MAP2, MAP3K19, MAP3K2, MAP4K3, MAP4K4, MARCH7, MARS2, MAT2A, MBOAT2, MCEE, MCFD2, MCM6, MDH1, MDH1B, MERTK, METAP1D, METTL21A, METTL5, METTL8, MGAT4A, MGAT5, MLTK, MMADHC, MOGAT1, MOGS, MPHOSPH10, MRPL19, MRPL33, MRPL35, MRPL44, MRPS5, MRPS9, MSGN1, MSH2, MSH6, MTERFD2, MTHFD2, MTX2, MXD1, MYO3B, MYT1L, NAB1, NABP1, NAGK, NCOA1, NDUFA10, NDUFS1, NEU2, NEU4, NFE2L2, NHEJ1, NIF3L1, NIFK, NLRC4, NMI, NOP58, NOTO, NPAS2, NPPC, NR4A2, NRBP1, NT5C1B, NT5C1B-RDH14, NUP35, ODC1, ORC2, ORC4, ORMDL1, OSGEPL1, OSR1, PAPOLG, PASK, PAX3, PAX8, PCBP1, PCGF1, PCYOX1, PDE11A, PDE1A, PDIA6, PDK1, PECR, PELI1, PER2, PEX13, PGAP1, PIGF, PIKFYVE, PKDCC, PLA2R1, PLB1, PLCD4, PLCL1, PLEK, PMS1, PNKD, PNPT1, POLE4, POLR1A, POLR1B, POLR2D, POMC, POU3F3, PPIG, PPIL3, PPM1B, PPM1G, PPP1CB, PREB, PREPL, PRKAG3, PRKCE, PRKD3, PRKRA, PRLH, PROC, PRPF40A, PRSS56, PSMD1, PSMD14, PSME4, PTCD3, PTMA, PTPN18, PTPN4, PTPRN, PUS10, QPCT, RAB1A, RANBP2, RBKS, RBMS1, REL, RETSAT, REV1, RFX8, RHBDD1, RNASEH1, RNF103, RNF144A, RNF149, RNF181, RNF25, RNPEPL1, ROCK2, RPE, RPIA, RPL31, RPL37A, RPS27A, RPS7, RQCD1, RRM2, SAP130, SATB2, SCLY, SCRN3, SDC1, SERTAD2, SF3B1, SF3B14, SFTPB, SGPP2, SH3YL1, SLC11A1, SLC19A3, SLC25A12, SLC30A6, SLC3A1, SLC5A6, SLC5A7, SMARCAL1, SMC6, SMEK2, SMPD4, SMYD1, SNRNP200, SNRNP27, SNRPG, SNX17, SOCS5, SOX11, SP100, SP110, SP5, SP9, SPAST, SPEG, SPOPL, SPR, SPTBN1, SRBD1, SRSF7, SSB, ST3GAL5, ST6GAL2, STAMBP, STAT1, STAT4, STK16, STK17B, STK25, STK36, STK39, STON1-GTF2A1L, STRADB, SUCLG1, SULT1C2, SULT1C4, SUMO1, SUPT7L, TAF1B, TBR1, TCF7L1, TET3, TFCP2L1, TFPI, THNSL2, TLK1, TLX2, TMEM18, TNP1, TP53I3, TPO, TPRKB, TRABD2A, TRAK2, TRIB2, TRIM54, TRIP12, TRMT61B, TSN, TTL, TTLL4, TTN, TUBA3D, TUBA4A, TWIST2, TYW5, UBE2E3, UBE2F, UBR3, UGGT1, UGP2, UGT1A1, UGT1A10, UGT1A3, UGT1A4, UGT1A5, UGT1A6, UGT1A7, UGT1A8, UGT1A9, UPP2, USP34, USP37, USP39, USP40, UXS1, VAX2, VRK2, WDR12, WDR33, WDR92, WDSUB1, XDH, XPO1, XRCC5, ZAP70, ZC3H8, ZEB2, ZFP36L2, ZNF142, ZNF2, ZNF512, ZNF513, ZNF514, ZNF638, ZRANB3, ZSWIM2"
Randomized tissue pcHi-C,Links w/ 5+ tissues vs Links w/ 1+ tissue,chr2,GO:0044238,BP,e,primary metabolic process     ,504/1136,506/1188,1.36e-10,2,504,8.06e-08,"AAK1, ABCB11, ABI2, ACADL, ACMSD, ACOXL, ACSL3, ACVR1, ACVR1C, ACVR2A, ADAM17, ADAM23, ADCY3, ADI1, AFF3, AGBL5, AGPS, AGXT, ALK, ANAPC1, ANKRD23, APLF, APOB, ARID5A, ASB1, ASB18, ASB3, ASNSD1, ASPRV1, ASTL, ASXL2, ATF2, ATG4B, ATIC, ATOH8, ATP5G3, ATP6V1B1, B3GALT1, B3GNT2, B3GNT7, BARD1, BAZ2B, BCL11A, BIRC6, BMP10, BMPR2, BRE, BUB1, BZW1, C1D, C2orf40, CACNB4, CAD, CALCRL, CALM2, CAPN10, CAPN13, CAPN14, CARF, CASP10, CASP8, CCDC88A, CCNT2, CCT4, CCT7, CDCA7, CDK15, CDKL4, CEBPZ, CERS6, CFLAR, CHPF, CHST10, CIR1, CLK1, CMPK2, CNNM3, CNOT11, COL3A1, COPS7B, COPS8, CPO, CPS1, CPSF3, CREB1, CSRNP3, CTDSP1, CUL3, CWC22, CYP1B1, CYP26B1, CYP27A1, D2HGDH, DARS, DBI, DCAF17, DCTN1, DDX1, DGKD, DGUOK, DHRS9, DIS3L2, DNAJB2, DNAJC10, DNER, DNMT3A, DNPEP, DPP10, DPP4, DPY30, DPYSL5, DTYMK, DUSP11, DUSP19, DUSP2, DUSP28, E2F6, ECEL1, EEF1B2, EFEMP1, EGR4, EIF2AK2, EIF2AK3, EIF2B4, EIF5B, EPAS1, EPC2, EPHA4, EPT1, ERBB4, ERCC3, ERLEC1, FABP1, FANCL, FAP, FARSB, FBXO11, FEV, FHL2, FIGLA, FKBP1B, FKBP7, FN1, FOSL2, FOXN2, G6PC2, GAD1, GALM, GALNT13, GALNT14, GALNT3, GALNT5, GBX2, GCFC2, GCG, GCKR, GDF7, GEMIN6, GEN1, GFPT1, GGCX, GIGYF2, GLB1L, GLI2, GLS, GMPPA, GPAT2, GPC1, GPD2, GPR75-ASB3, GRHL1, GTF2A1L, GTF3C2, GTF3C3, HAAO, HADHA, HADHB, HAT1, HDAC4, HDLBP, HECW2, HES6, HIBCH, HK2, HNRNPA3, HNRNPLL, HOXD1, HOXD10, HOXD11, HOXD12, HOXD13, HOXD3, HOXD4, HOXD8, HOXD9, HS6ST1, HSPD1, HTR2B, HTRA2, IAH1, IDH1, IFIH1, IFT172, IGFBP2, IGFBP5, IHH, IKZF2, IL1RN, ILKAP, IMP4, ING5, INHA, INO80B, INO80D, INPP1, INPP4A, INPP5D, INSIG2, IRS1, ITGB1BP1, IWS1, KANSL3, KCNIP3, KDM3A, KHK, KLF11, KLF7, KLHL41, KYNU, LBH, LBX2, LCLAT1, LCT, LIPT1, LONRF2, LPIN1, LRP2, LRPPRC, LRRFIP1, M1AP, MAP2, MAP3K19, MAP3K2, MAP4K3, MAP4K4, MARCH7, MARS2, MBOAT2, MCEE, MCFD2, MCM6, MDH1, MDH1B, MERTK, METAP1D, METTL21A, METTL5, METTL8, MGAT4A, MGAT5, MLTK, MOGAT1, MOGS, MPHOSPH10, MRPL19, MRPL33, MRPL35, MRPL44, MRPS5, MRPS9, MSGN1, MSH2, MSH6, MTERFD2, MTX2, MXD1, MYO3B, MYT1L, NAB1, NABP1, NCOA1, NDUFA10, NDUFS1, NEU2, NEU4, NFE2L2, NHEJ1, NIFK, NMI, NOP58, NOTO, NPAS2, NPPC, NR4A2, NRBP1, NT5C1B, NT5C1B-RDH14, NUP35, ODC1, ORC2, ORC4, ORMDL1, OSGEPL1, OSR1, PAPOLG, PASK, PAX3, PAX8, PCBP1, PCGF1, PCYOX1, PDE11A, PDE1A, PDIA6, PDK1, PECR, PELI1, PER2, PEX13, PGAP1, PIGF, PIKFYVE, PKDCC, PLB1, PLCD4, PLCL1, PLEK, PMS1, PNPT1, POLE4, POLR1A, POLR1B, POLR2D, POMC, POU3F3, PPIG, PPIL3, PPM1B, PPM1G, PPP1CB, PREB, PREPL, PRKAG3, PRKCE, PRKD3, PRKRA, PRLH, PROC, PRPF40A, PRSS56, PSMD1, PSMD14, PSME4, PTCD3, PTMA, PTPN18, PTPN4, PTPRN, PUS10, QPCT, RANBP2, RBKS, RBMS1, REL, RETSAT, REV1, RFX8, RHBDD1, RNASEH1, RNF103, RNF144A, RNF149, RNF181, RNF25, RNPEPL1, ROCK2, RPE, RPIA, RPL31, RPL37A, RPS27A, RPS7, RQCD1, RRM2, SAP130, SATB2, SCLY, SCRN3, SDC1, SERTAD2, SF3B1, SF3B14, SFTPB, SGPP2, SH3YL1, SLC25A12, SLC30A6, SLC3A1, SMARCAL1, SMC6, SMEK2, SMPD4, SMYD1, SNRNP200, SNRNP27, SNRPG, SNX17, SOCS5, SOX11, SP100, SP110, SP5, SP9, SPAST, SPEG, SPOPL, SPTBN1, SRBD1, SRSF7, SSB, ST3GAL5, ST6GAL2, STAMBP, STAT1, STAT4, STK16, STK17B, STK25, STK36, STK39, STON1-GTF2A1L, STRADB, SUCLG1, SULT1C2, SULT1C4, SUMO1, SUPT7L, TAF1B, TBR1, TCF7L1, TET3, TFCP2L1, TFPI, THNSL2, TLK1, TLX2, TMEM18, TNP1, TP53I3, TPRKB, TRABD2A, TRAK2, TRIB2, TRIP12, TRMT61B, TSN, TTL, TTLL4, TTN, TUBA3D, TUBA4A, TWIST2, TYW5, UBE2E3, UBE2F, UBR3, UGGT1, UGP2, UGT1A1, UGT1A10, UGT1A3, UGT1A4, UGT1A5, UGT1A6, UGT1A7, UGT1A8, UGT1A9, UPP2, USP34, USP37, USP39, USP40, UXS1, VAX2, VRK2, WDR12, WDR33, WDR92, WDSUB1, XDH, XPO1, XRCC5, ZAP70, ZC3H8, ZEB2, ZFP36L2, ZNF142, ZNF2, ZNF512, ZNF513, ZNF514, ZNF638, ZRANB3, ZSWIM2"
Randomized tissue pcHi-C,Links w/ 5+ tissues vs Links w/ 1+ tissue,chr2,GO:0006807,BP,e,nitrogen compound metabolic process,468/1136,470/1188,2.02e-09,2,468,1.1e-06,"AAK1, ABCB6, ABI2, ACADL, ACMSD, ACVR1, ACVR1C, ACVR2A, ADAM17, ADAM23, ADCY3, ADI1, AFF3, AGBL5, AGXT, ALK, ALLC, ANAPC1, AOX1, APLF, APOB, ARID5A, ASB1, ASB18, ASB3, ASNSD1, ASPRV1, ASTL, ASXL2, ATF2, ATG4B, ATIC, ATOH8, ATP5G3, ATP6V1B1, B3GALT1, B3GNT2, B3GNT7, BARD1, BAZ2B, BCL11A, BIRC6, BMP10, BMPR2, BRE, BUB1, BZW1, C1D, C2orf40, CACNB4, CAD, CALCRL, CALM2, CAPN10, CAPN13, CAPN14, CARF, CASP10, CASP8, CCDC88A, CCNT2, CCT4, CCT7, CDCA7, CDK15, CDKL4, CEBPZ, CERS6, CFLAR, CHPF, CIR1, CLK1, CMPK2, CNNM3, CNOT11, COL3A1, COPS7B, COPS8, CPO, CPS1, CPSF3, CREB1, CSRNP3, CTDSP1, CUL3, CWC22, D2HGDH, DARS, DCAF17, DCTN1, DDX1, DGUOK, DIS3L2, DNAJB2, DNAJC10, DNER, DNMT3A, DNPEP, DPP10, DPP4, DPY30, DPYSL5, DTYMK, DUSP11, DUSP19, DUSP2, DUSP28, E2F6, ECEL1, EEF1B2, EFEMP1, EGR4, EIF2AK2, EIF2AK3, EIF2B4, EIF5B, EPAS1, EPC2, EPHA4, ERBB4, ERCC3, ERLEC1, FANCL, FAP, FARSB, FBXO11, FEV, FHL2, FIGLA, FKBP1B, FKBP7, FN1, FOSL2, FOXN2, GAD1, GALNT13, GALNT14, GALNT3, GALNT5, GBX2, GCFC2, GCG, GCKR, GDF7, GEMIN6, GEN1, GFPT1, GGCX, GIGYF2, GLI2, GLS, GMPPA, GPC1, GPR75-ASB3, GRHL1, GTF2A1L, GTF3C2, GTF3C3, HAAO, HAT1, HDAC4, HECW2, HES6, HIBCH, HK2, HNRNPA3, HNRNPLL, HOXD1, HOXD10, HOXD11, HOXD12, HOXD13, HOXD3, HOXD4, HOXD8, HOXD9, HS6ST1, HSPD1, HTR2B, HTRA2, IDH1, IFIH1, IFT172, IGFBP2, IGFBP5, IHH, IKZF2, IL1B, ILKAP, IMP4, ING5, INHA, INO80B, INO80D, ITGB1BP1, IWS1, KANSL3, KCNIP3, KDM3A, KLF11, KLF7, KLHL41, KYNU, LBH, LBX2, LIPT1, LONRF2, LPIN1, LRP2, LRPPRC, LRRFIP1, LYG1, LYG2, M1AP, MAP2, MAP3K19, MAP3K2, MAP4K3, MAP4K4, MARCH7, MARS2, MAT2A, MBOAT2, MCEE, MCFD2, MCM6, MDH1, MERTK, METAP1D, METTL21A, METTL5, METTL8, MGAT4A, MGAT5, MLTK, MMADHC, MOGS, MPHOSPH10, MRPL19, MRPL33, MRPL35, MRPL44, MRPS5, MRPS9, MSGN1, MSH2, MSH6, MTERFD2, MTHFD2, MTX2, MXD1, MYO3B, MYT1L, NAB1, NABP1, NAGK, NCOA1, NDUFA10, NDUFS1, NEU2, NEU4, NFE2L2, NHEJ1, NIF3L1, NIFK, NMI, NOP58, NOSTRIN, NOTO, NPAS2, NPPC, NR4A2, NRBP1, NT5C1B, NT5C1B-RDH14, ODC1, ORC2, ORC4, ORMDL1, OSGEPL1, OSR1, PAPOLG, PASK, PAX3, PAX8, PCBP1, PCGF1, PCYOX1, PDE11A, PDE1A, PDIA6, PDK1, PELI1, PER2, PGAP1, PIGF, PIKFYVE, PKDCC, PLB1, PMS1, PNKD, PNPT1, POLE4, POLR1A, POLR1B, POLR2D, POMC, POU3F3, PPIG, PPIL3, PPM1B, PPM1G, PPP1CB, PREB, PREPL, PRKCE, PRKD3, PRKRA, PROC, PRPF40A, PRSS56, PSMD1, PSMD14, PSME4, PTCD3, PTMA, PTPN18, PTPN4, PTPRN, PUS10, QPCT, RANBP2, RBMS1, REL, REV1, RFX8, RHBDD1, RNASEH1, RNF103, RNF144A, RNF149, RNF181, RNF25, RNPEPL1, ROCK2, RPE, RPIA, RPL31, RPL37A, RPS27A, RPS7, RQCD1, RRM2, SAP130, SATB2, SCLY, SCRN3, SDC1, SERTAD2, SF3B1, SF3B14, SFTPB, SGPP2, SLC19A3, SLC30A6, SLC3A1, SLC5A6, SLC5A7, SMARCAL1, SMC6, SMEK2, SMPD4, SMYD1, SNRNP200, SNRNP27, SNRPG, SOCS5, SOX11, SP100, SP110, SP5, SP9, SPAST, SPEG, SPOPL, SPR, SPTBN1, SRBD1, SRSF7, SSB, ST3GAL5, ST6GAL2, STAMBP, STAT1, STAT4, STK16, STK17B, STK25, STK36, STK39, STON1-GTF2A1L, STRADB, SUCLG1, SULT1C2, SULT1C4, SUMO1, SUPT7L, TAF1B, TBR1, TCF7L1, TET3, TFCP2L1, TFPI, THNSL2, TLK1, TLX2, TMEM18, TNP1, TP53I3, TPO, TPRKB, TRABD2A, TRAK2, TRIB2, TRIP12, TRMT61B, TSN, TTL, TTLL4, TTN, TUBA3D, TUBA4A, TWIST2, TYW5, UBE2E3, UBE2F, UBR3, UGGT1, UGP2, UGT1A1, UGT1A8, UPP2, USP34, USP37, USP39, USP40, UXS1, VAX2, VRK2, WDR12, WDR33, WDR92, WDSUB1, XDH, XPO1, XRCC5, ZAP70, ZC3H8, ZEB2, ZFP36L2, ZNF142, ZNF2, ZNF512, ZNF513, ZNF514, ZNF638, ZRANB3, ZSWIM2"
Randomized tissue pcHi-C,Links w/ 5+ tissues vs Links w/ 1+ tissue,chr2,GO:0065007,BP,e,biological regulation         ,593/1136,601/1188,1.03e-07,1,593,5.22e-05,"AAK1, AAMP, ABCA12, ABCB6, ABCG5, ABCG8, ACADL, ACKR3, ACSL3, ACTR2, ACTR3, ACVR1, ACVR1C, ACVR2A, ADAM17, ADCY3, ADD2, ADI1, ADRA2B, AFF3, AGAP1, AGFG1, ALK, ALMS1, ALS2, ALS2CR12, AMER3, ANAPC1, ANXA4, APOB, ARHGAP15, ARHGAP25, ARHGEF33, ARHGEF4, ARID5A, ARL4C, ARL5A, ARPC2, ASAP2, ASB1, ASB18, ASB3, ASTL, ASXL2, ATF2, ATG4B, ATOH8, ATP6V1B1, ATP6V1C2, ATP6V1E2, ATRAID, BARD1, BAZ2B, BCL11A, BCL2L11, BIN1, BIRC6, BMP10, BMPR2, BOK, BOLL, BRE, BUB1, BZW1, C1D, C2orf81, CAB39, CACNB4, CAD, CALCRL, CALM2, CAPG, CAPN10, CARF, CASP10, CASP8, CCDC88A, CCL20, CCNT2, CCNYL1, CD28, CD8A, CD8B, CDC42EP3, CDCA7, CDK5R2, CEBPZ, CERKL, CERS6, CFLAR, CGREF1, CHN1, CHRNA1, CHRND, CHRNG, CIAO1, CIR1, CLASP1, CLK1, CNGA3, CNOT11, CNPPD1, COL3A1, COL4A3, COMMD1, CPS1, CREB1, CRIM1, CSRNP3, CTDSP1, CTLA4, CTNNA2, CUL3, CWC22, CXCR1, CXCR2, CXCR4, CYBRD1, CYP26B1, CYTIP, DAPL1, DCDC2C, DCTN1, DDX1, DES, DGKD, DGUOK, DHRS9, DIS3L2, DLX1, DLX2, DNAJB2, DNAJC10, DNAJC27, DNER, DNMT3A, DOCK10, DOK1, DPP4, DPY30, DPYSL5, DUSP19, DUSP2, E2F6, ECEL1, EDAR, EFEMP1, EGR4, EHD3, EIF2AK2, EIF2AK3, EIF2B4, EIF4E2, EIF5B, EMILIN1, EML4, EMX1, EN1, EPAS1, EPB41L5, EPC2, EPCAM, EPHA4, ERBB4, ERCC3, ERMN, EVX2, FABP1, FAM110C, FAM132B, FANCL, FAP, FARP2, FEV, FEZ2, FHL2, FIGLA, FKBP1B, FMNL2, FN1, FOSL2, FOXN2, FRZB, FSHR, FZD5, FZD7, G6PC2, GAD1, GBX2, GCC2, GCFC2, GCG, GCKR, GDF7, GFPT1, GGCX, GIGYF2, GKN1, GLI2, GLS, GMCL1, GPBAR1, GPC1, GPR1, GPR113, GPR148, GPR155, GPR17, GPR35, GPR39, GPR45, GPR55, GPR75-ASB3, GRB14, GRHL1, GTF2A1L, GULP1, HAAO, HAT1, HDAC4, HES6, HJURP, HK2, HNRNPLL, HOXD1, HOXD10, HOXD11, HOXD12, HOXD13, HOXD3, HOXD4, HOXD8, HOXD9, HPCAL1, HSPD1, HSPE1, HTR2B, HTRA2, ICOS, ID2, IFIH1, IFT172, IGFBP2, IGFBP5, IHH, IKZF2, IL18R1, IL18RAP, IL1A, IL1B, IL1R1, IL1RL1, IL1RL2, IL1RN, IL36A, IL36B, IL36G, IL36RN, ILKAP, IMMT, ING5, INHA, INHBB, INO80B, INO80D, INPP1, INPP4A, INPP5D, INSIG2, IRS1, ITGA4, ITGA6, ITGAV, ITGB1BP1, ITGB6, ITM2C, ITSN2, IWS1, KCNH7, KCNIP3, KCNK3, KCNS3, KDM3A, KIAA1715, KIDINS220, KIF3C, KLF11, KLF7, KLHL41, LBH, LBX2, LHCGR, LIMS1, LIMS2, LOXL3, LPIN1, LRP2, LRPPRC, LRRFIP1, LTBP1, MAL, MALL, MAP3K2, MAP4K3, MAP4K4, MAPRE3, MARCO, MBD5, MEIS1, MEMO1, MERTK, MFF, MLTK, MOB1A, MPHOSPH10, MPV17, MSGN1, MSH2, MSH6, MSTN, MTA3, MTIF2, MYCN, MYO3B, MYT1L, NAB1, NABP1, NCK2, NCKAP1, NCOA1, NDUFS1, NEB, NEUROD1, NFE2L2, NGEF, NHEJ1, NIF3L1, NIFK, NLRC4, NMI, NMS, NMUR1, NOSTRIN, NOTO, NPAS2, NPHP1, NPPC, NR4A2, NRP2, NRXN1, NTSR2, NUP35, NXPH2, NYAP2, OBSL1, ODC1, OR6B2, OR6B3, ORC2, OSR1, OTX1, OXER1, PAIP2B, PASK, PAX3, PAX8, PCGF1, PDCD1, PDE11A, PDE1A, PDIA6, PDK1, PELI1, PER2, PID1, PIKFYVE, PKDCC, PKP4, PLA2R1, PLB1, PLCD4, PLCL1, PLEK, PLEKHH2, PLEKHM3, PNPT1, POLR2D, POMC, POU3F3, PPM1B, PPM1G, PPP1CB, PPP1R1C, PPP1R7, PPP3R1, PREB, PRKAG3, PRKCE, PRKD3, PRKRA, PRLH, PROC, PROKR1, PRPF40A, PSD4, PSMD1, PSMD14, PSME4, PTCD3, PTH2R, PTPRN, PUM2, PXDN, RAB10, RAB11FIP5, RAB17, RAB1A, RAB3GAP1, RAB6C, RABL2A, RALB, RAMP1, RANBP2, RAPGEF4, RAPH1, RASGRP3, REG1A, REG3A, REG3G, REL, RETSAT, RFX8, RHBDD1, RHOB, RHOQ, RIF1, RND3, RNF25, ROCK2, RPL31, RPL37A, RPRM, RPS27A, RPS7, RQCD1, RRM2, RSAD2, RTKN, RTN4, SAG, SAP130, SATB2, SCG2, SCN1A, SCN2A, SCN7A, SCN9A, SCTR, SDC1, SEMA4C, SEMA4F, SEPT2, SERPINE2, SERTAD2, SFXN5, SH3BP4, SH3YL1, SIX2, SIX3, SLC11A1, SLC20A1, SLC30A3, SLC35F6, SLC40A1, SLC4A10, SLC4A3, SLC5A7, SLC8A1, SLC9A2, SLC9A4, SMARCAL1, SMEK2, SMYD1, SNX17, SOCS5, SOS1, SOX11, SP100, SP110, SP140, SP3, SP5, SP9, SPAST, SPDYA, SPEG, SPOPL, SPP2, SPR, SPRED2, SPTBN1, SRSF7, STAM2, STAMBP, STAT1, STAT4, STEAP3, STK16, STK17B, STK25, STK36, STK39, STON1, STRADB, STRN, SUMO1, SUPT7L, TACR1, TANK, TBC1D8, TBR1, TCF7L1, TET3, TFCP2L1, TFPI, TGFA, TGFBRAP1, TIA1, TLK1, TLX2, TMEM127, TMEM17, TMEM198, TMEM237, TMSB10, TNFAIP6, TNP1, TNS1, TP53I3, TPO, TRABD2A, TRAK2, TRIB2, TRIM54, TRIP12, TRPM8, TTC21B, TTC7A, TTL, TTN, TUBA4A, TWIST2, TXNDC9, UBE2E3, UBXN2A, UCN, UGT1A1, UGT1A3, UGT1A7, UGT1A8, UGT1A9, UNC50, USP34, VAMP8, VAX2, VIL1, VIT, VPS54, VRK2, VWC2L, WDPCP, WDR12, WIPF1, WNT10A, WNT6, XDH, XPO1, XRCC5, YWHAQ, ZAP70, ZC3H15, ZC3H8, ZEB2, ZFP36L2, ZNF142, ZNF2, ZNF385B, ZNF512, ZNF513, ZNF514, ZNF638, ZRANB3, ZSWIM2"
