DS,What,chr,GO,NS,enrichment,name,ratio_in_study,ratio_in_pop,p_uncorrected,depth,study_count,p_fdr_bh,study_items
Blood cell pcHi-C,Links w/ 5+ tissues vs Links w/ 1+ tissue,chr1,GO:0043227,CC,e,membrane-bounded organelle    ,742/1615,789/1784,4.59e-06,3,742,0.0258,"ABCB10, ABCD3, ACADM, ACBD3, ACBD6, ACOT7, ACP6, ACTA1, ADAM15, ADAR, ADC, ADCK3, ADORA1, ADPRHL2, AGL, AGMAT, AGTRAP, AHCTF1, AHCYL1, AIM2, AK2, AK4, AKIRIN1, AKR7A2, AKR7A3, AKT3, ALDH4A1, ALDH9A1, ALX3, ANKRD13C, ANP32E, AP4B1, APH1A, APOA1BP, APOA2, ARF1, ARHGAP30, ARHGEF2, ARID1A, ARID4B, ARL8A, ARNT, ASCL5, ASH1L, ASPM, ATAD3A, ATF3, ATF6, ATP13A2, ATP1A1, ATP1A2, ATP5F1, ATP6V0B, ATPAF1, ATPIF1, AURKAIP1, AVPR1B, B3GALNT2, B4GALT3, BARHL2, BATF3, BCL10, BCL9, BEND5, BGLAP, BLZF1, BNIPL, BOLA1, BRDT, BTBD8, C1orf174, C1orf61, C1orf85, CACNA1S, CACYBP, CAMTA1, CAPN2, CAPN8, CAPZB, CASP9, CASQ1, CASQ2, CASZ1, CATSPER4, CC2D1B, CCBL2, CCDC181, CCDC19, CCNL2, CCSAP, CD34, CD46, CDC14A, CDC42, CDC42SE1, CDC7, CDC73, CDCA8, CDK11A, CDKN2C, CELF3, CENPF, CENPL, CEP350, CERS2, CHD1L, CHD5, CHI3L1, CHIT1, CHTOP, CITED4, CLCA1, CLCC1, CLDN19, CLIC4, CLK2, CLSTN1, CMPK1, CNIH4, CNST, COA6, COX20, CPSF3L, CRABP2, CREB3L4, CRP, CRTC2, CRYZ, CSRP1, CTBS, CTH, CTNNBIP1, CTSE, CTSK, CTSS, CYB5R1, DAP3, DARC, DARS2, DBT, DCAF6, DCAF8, DCLRE1B, DDAH1, DDOST, DDX20, DEGS1, DENND1B, DENND4B, DEPDC1, DFFA, DFFB, DHCR24, DHX9, DIEXF, DISC1, DMAP1, DMRTA2, DMRTB1, DNAH14, DNAJB4, DNAJC11, DNASE2B, DNM3, DNTTIP2, DPM3, DR1, DRAM2, DSTYK, DTL, DUSP10, DUSP12, DUSP23, DVL1, DYRK3, E2F2, EBNA1BP2, ECE1, EGLN1, ELF3, ELK4, ELOVL1, ENO1, EPB41, EPS15, ERMAP, ERO1LB, ERRFI1, ETV3, ETV3L, EVI5, EXO1, EXO5, EXOC8, EXOSC10, EXTL2, EYA3, F5, FAF1, FAM129A, FAM20B, FASLG, FBLIM1, FBXO2, FCRLB, FDPS, FH, FHL3, FLG, FLVCR1, FMO1, FMO3, FMO4, FMO5, FNBP1L, FNDC5, FOXD2, FOXE3, FOXJ3, FUBP1, FUCA1, G0S2, GABPB2, GADD45A, GALNT2, GATAD2B, GBP2, GBP4, GBP5, GFI1, GLIS1, GLRX2, GLTPD1, GLUL, GMEB1, GNAI3, GNL2, GNPAT, GON4L, GORAB, GPBP1L1, GPR161, GPSM2, GTF2B, H3F3A, H6PD, HAO2, HAX1, HDAC1, HDGF, HEATR1, HECTD3, HES2, HES3, HES4, HEYL, HIPK1, HIST2H2AA3, HIST2H2AA4, HIST2H2AB, HIST2H2AC, HIST2H2BE, HIST2H2BF, HIST3H2A, HIST3H2BB, HIVEP3, HLX, HMGCL, HMGCS2, HMGN2, HNRNPR, HNRNPU, HORMAD1, HP1BP3, HRNR, HS2ST1, HSPB11, HSPB7, HSPG2, HTR6, IARS2, IBA57, ICMT, ID3, IFI16, IFI6, IGFN1, IKBKE, IL24, ILF2, INPP5B, INTS3, IPO13, IPO9, IRF2BP2, IRF6, ISG20L2, ITGB3BP, IVNS1ABP, JAK1, JTB, JUN, KCNK1, KDM1A, KDM4A, KDM5B, KHDRBS1, KIAA0319L, KIAA1324, KIF14, KIF2C, KIFAP3, KLHL12, KLHL20, KMO, KNCN, KPNA6, LAMC1, LAMTOR2, LAMTOR5, LAPTM5, LAX1, LBR, LCK, LDLRAP1, LEPRE1, LEPROT, LHX4, LHX8, LHX9, LIN28A, LIN9, LMNA, LMX1A, LPAR3, LRIF1, LUZP1, MACF1, MAD2L2, MAEL, MAGI3, MAN1A2, MAP1LC3C, MAPKAPK2, MARC1, MARC2, MCL1, MDM4, MEAF6, MECR, MEF2D, MEX3A, MFN2, MGST3, MIB2, MIER1, MINOS1, MINOS1-NBL1, MKNK1, MMACHC, MMEL1, MNDA, MPC2, MR1, MRPL20, MRPL24, MRPL37, MRPL55, MRPL9, MRPS15, MRTO4, MSH4, MTF1, MTF2, MTOR, MTX1, MUL1, MUTYH, MYCBP, MYCL, MYOC, MYSM1, NASP, NCF2, NCSTN, NDUFS2, NDUFS5, NEK7, NFIA, NFYC, NGF, NHLH1, NIT1, NMNAT1, NMNAT2, NOC2L, NOTCH2, NPHP4, NPPA, NR1I3, NR5A2, NRD1, NSL1, NSUN4, NTRK1, NUCKS1, NUF2, NVL, OAZ3, OMA1, OPRD1, ORC1, OSBPL9, OTUD7B, OVGP1, PABPC4, PADI3, PADI4, PARK7, PARP1, PARS2, PBX1, PBXIP1, PDC, PDE4B, PDE4DIP, PDIK1L, PER3, PEX10, PEX11B, PEX14, PEX19, PFDN2, PHC2, PHF13, PHLDA3, PI4KB, PIAS3, PIFO, PIK3C2B, PINK1, PIP5K1A, PKN2, PKP1, PLA2G2A, PLA2G4A, PLEKHG5, PLEKHO1, PLK3, PLOD1, PMF1, PMVK, PNRC2, POGK, POGZ, POLR3C, POU2F1, POU3F1, PPAP2B, PPIE, PPOX, PPP1R8, PPP2R5A, PPT1, PRCC, PRDM16, PRDM2, PRDX1, PRDX6, PRKCZ, PRMT6, PROX1, PRPF3, PRRX1, PRUNE, PSEN2, PSMA5, PSMB2, PSMB4, PTAFR, PTBP2, PTGFRN, PTGS2, PTP4A2, PTPN14, PTPN22, PYGO2, RAB13, RAB25, RAB3B, RAB4A, RAB7L1, RABGAP1L, RAD54L, RAP1A, RASSF5, RAVER2, RBBP4, RBBP5, RBM15, RBM34, RBM8A, RBMXL1, RCC1, RCOR3, RERE, RFWD2, RFX5, RGS13, RGS2, RHOC, RLF, RNASEL, RNF11, RNF187, RNF19B, RNF2, RNPC3, RORC, RP11-426L16.10, RPAP2, RPE65, RPL5, RPS27, RPS6KA1, RPS6KC1, RRAGC, RRP15, RSBN1, RSC1A1, RSG1, RTCA, RUNX3, RUSC1, RWDD3, RXRG, RYR2, S100A1, S100A11, S100A12, S100A13, S100A16, S100A4, S100A5, S100A6, S100A7, S100A9, S100PBP, SAMD11, SAMD13, SARS, SCCPDH, SCNM1, SCYL3, SDF4, SDHB, SDHC, SELP, SERBP1, SESN2, SETDB1, SF3A3, SFN, SGIP1, SH3BGRL3, SIKE1, SKI, SLC16A1, SLC25A24, SLC25A33, SLC25A34, SLC25A44, SLC27A3, SLC2A1, SLC30A2, SLC30A7, SLC35A3, SLC35D1, SLC50A1, SLC6A17, SMAP2, SMCP, SMG5, SMG7, SMYD2, SMYD3, SNAPIN, SNIP1, SNRPE, SNX27, SOAT1, SORT1, SOX13, SPAG17, SPEN, SPOCD1, SPRTN, SRRM1, SRSF10, SRSF11, SRSF4, SSBP3, SSR2, SSU72, SSX2IP, STK40, STPG1, STRIP1, STX12, STX6, STXBP3, SUCO, SV2A, SYCP1, SYF2, SYPL2, SYT11, SYT2, SYTL1, SZT2, TACSTD2, TAF12, TAF13, TAF5L, TAL1, TARBP1, TARDBP, TARS2, TATDN3, TBX15, TBX19, TCEANC2, TDRKH, TEKT2, TESK2, TEX35, TFAP2E, TFB2M, TGFBR3, THEM4, THEM5, THEMIS2, THRAP3, TIMM17A, TMED5, TMEM50A, TMEM57, TMEM59, TMEM9, TNFRSF1B, TNNI3K, TNR, TOE1, TOMM20, TOMM40L, TOR1AIP2, TP53BP2, TP73, TPR, TPRG1L, TRAF3IP3, TRAPPC3, TRIM11, TRIM33, TRIM45, TRIM63, TRNAU1AP, TROVE2, TSNAX, TSTD1, TTF2, TTLL7, TXNIP, UAP1, UBE2J2, UBIAD1, UBQLN4, UBR4, UCHL5, UCK2, UHMK1, UQCRH, URB2, UROD, USF1, USP1, USP21, USP33, USP48, VAMP3, VAMP4, VCAM1, VHLL, VPS45, VPS72, WARS2, WASF2, WDR26, WDR3, WDR77, WDTC1, WLS, YARS, YBX1, YIPF1, YRDC, YY1AP1, ZBED6, ZBTB18, ZBTB37, ZBTB40, ZBTB41, ZBTB48, ZBTB7B, ZBTB8A, ZBTB8B, ZC3H12A, ZCCHC11, ZFP69, ZFP69B, ZFYVE9, ZMYM1, ZMYM6, ZNF124, ZNF281, ZNF326, ZNF362, ZNF496, ZNF644, ZNF648, ZNF669, ZNF670, ZNF672, ZNF678, ZNF683, ZNF684, ZNF691, ZNF692, ZNF695, ZNF697, ZRANB2, ZSCAN20"
Blood cell pcHi-C,Links w/ 5+ tissues vs Links w/ 1+ tissue,chr1,GO:0043231,CC,e,intracellular membrane-bounded organelle,728/1615,774/1784,6.33e-06,4,728,0.0258,"ABCB10, ABCD3, ACADM, ACBD3, ACBD6, ACOT7, ACP6, ADAM15, ADAR, ADC, ADCK3, ADORA1, ADPRHL2, AGL, AGMAT, AGTRAP, AHCTF1, AHCYL1, AIM2, AK2, AK4, AKIRIN1, AKR7A2, AKR7A3, AKT3, ALDH4A1, ALDH9A1, ALX3, ANKRD13C, ANP32E, AP4B1, APH1A, APOA1BP, APOA2, ARF1, ARHGAP30, ARHGEF2, ARID1A, ARID4B, ARL8A, ARNT, ASCL5, ASH1L, ASPM, ATAD3A, ATF3, ATF6, ATP13A2, ATP1A1, ATP1A2, ATP5F1, ATP6V0B, ATPAF1, ATPIF1, AURKAIP1, AVPR1B, B3GALNT2, B4GALT3, BARHL2, BATF3, BCL10, BCL9, BEND5, BGLAP, BLZF1, BNIPL, BOLA1, BRDT, BTBD8, C1orf174, C1orf61, C1orf85, CACNA1S, CACYBP, CAMTA1, CAPN2, CAPN8, CAPZB, CASP9, CASQ1, CASQ2, CASZ1, CATSPER4, CC2D1B, CCBL2, CCDC181, CCDC19, CCNL2, CD34, CD46, CDC14A, CDC42, CDC42SE1, CDC7, CDC73, CDCA8, CDK11A, CDKN2C, CELF3, CENPF, CENPL, CEP350, CERS2, CHD1L, CHD5, CHI3L1, CHIT1, CHTOP, CITED4, CLCA1, CLCC1, CLDN19, CLIC4, CLK2, CLSTN1, CMPK1, CNIH4, CNST, COA6, COX20, CPSF3L, CRABP2, CREB3L4, CRP, CRTC2, CRYZ, CSRP1, CTBS, CTH, CTNNBIP1, CTSE, CTSK, CTSS, CYB5R1, DAP3, DARC, DARS2, DBT, DCAF6, DCAF8, DCLRE1B, DDAH1, DDOST, DDX20, DEGS1, DENND1B, DENND4B, DEPDC1, DFFA, DFFB, DHCR24, DHX9, DIEXF, DISC1, DMAP1, DMRTA2, DMRTB1, DNAJB4, DNAJC11, DNASE2B, DNM3, DNTTIP2, DPM3, DR1, DRAM2, DSTYK, DTL, DUSP10, DUSP12, DUSP23, DVL1, DYRK3, E2F2, EBNA1BP2, ECE1, EGLN1, ELF3, ELK4, ELOVL1, ENO1, EPB41, EPS15, ERMAP, ERO1LB, ERRFI1, ETV3, ETV3L, EVI5, EXO1, EXO5, EXOC8, EXOSC10, EXTL2, EYA3, F5, FAF1, FAM129A, FAM20B, FASLG, FBLIM1, FBXO2, FCRLB, FDPS, FH, FHL3, FLG, FLVCR1, FMO1, FMO3, FMO4, FMO5, FNBP1L, FNDC5, FOXD2, FOXE3, FOXJ3, FUBP1, FUCA1, G0S2, GABPB2, GADD45A, GALNT2, GATAD2B, GBP2, GBP4, GBP5, GFI1, GLIS1, GLRX2, GLTPD1, GLUL, GMEB1, GNAI3, GNL2, GNPAT, GON4L, GORAB, GPBP1L1, GPR161, GPSM2, GTF2B, H3F3A, H6PD, HAO2, HAX1, HDAC1, HDGF, HEATR1, HECTD3, HES2, HES3, HES4, HEYL, HIPK1, HIST2H2AA3, HIST2H2AA4, HIST2H2AB, HIST2H2AC, HIST2H2BE, HIST2H2BF, HIST3H2A, HIST3H2BB, HIVEP3, HLX, HMGCL, HMGCS2, HMGN2, HNRNPR, HNRNPU, HORMAD1, HP1BP3, HS2ST1, HSPB7, IARS2, IBA57, ICMT, ID3, IFI16, IFI6, IGFN1, IKBKE, IL24, ILF2, INPP5B, INTS3, IPO13, IPO9, IRF2BP2, IRF6, ISG20L2, ITGB3BP, IVNS1ABP, JAK1, JTB, JUN, KCNK1, KDM1A, KDM4A, KDM5B, KHDRBS1, KIAA0319L, KIAA1324, KIF14, KIF2C, KIFAP3, KLHL12, KLHL20, KMO, KPNA6, LAMTOR2, LAMTOR5, LAPTM5, LAX1, LBR, LCK, LDLRAP1, LEPRE1, LEPROT, LHX4, LHX8, LHX9, LIN28A, LIN9, LMNA, LMX1A, LPAR3, LRIF1, LUZP1, MACF1, MAD2L2, MAEL, MAGI3, MAN1A2, MAP1LC3C, MAPKAPK2, MARC1, MARC2, MCL1, MDM4, MEAF6, MECR, MEF2D, MEX3A, MFN2, MGST3, MIB2, MIER1, MINOS1, MINOS1-NBL1, MKNK1, MMACHC, MMEL1, MNDA, MPC2, MR1, MRPL20, MRPL24, MRPL37, MRPL55, MRPL9, MRPS15, MRTO4, MSH4, MTF1, MTF2, MTOR, MTX1, MUL1, MUTYH, MYCBP, MYCL, MYOC, MYSM1, NASP, NCF2, NCSTN, NDUFS2, NDUFS5, NEK7, NFIA, NFYC, NGF, NHLH1, NIT1, NMNAT1, NMNAT2, NOC2L, NOTCH2, NPPA, NR1I3, NR5A2, NRD1, NSL1, NSUN4, NTRK1, NUCKS1, NUF2, NVL, OAZ3, OMA1, ORC1, OSBPL9, OTUD7B, OVGP1, PABPC4, PADI3, PADI4, PARK7, PARP1, PARS2, PBX1, PBXIP1, PDC, PDE4B, PDE4DIP, PDIK1L, PER3, PEX10, PEX11B, PEX14, PEX19, PFDN2, PHC2, PHF13, PHLDA3, PI4KB, PIAS3, PIFO, PIK3C2B, PINK1, PIP5K1A, PKN2, PKP1, PLA2G2A, PLA2G4A, PLEKHG5, PLEKHO1, PLK3, PLOD1, PMF1, PMVK, PNRC2, POGK, POGZ, POLR3C, POU2F1, POU3F1, PPAP2B, PPIE, PPOX, PPP1R8, PPP2R5A, PPT1, PRCC, PRDM16, PRDM2, PRDX1, PRDX6, PRKCZ, PRMT6, PROX1, PRPF3, PRRX1, PRUNE, PSEN2, PSMA5, PSMB2, PSMB4, PTAFR, PTBP2, PTGFRN, PTGS2, PTP4A2, PTPN14, PTPN22, PYGO2, RAB13, RAB25, RAB3B, RAB4A, RAB7L1, RABGAP1L, RAD54L, RAP1A, RASSF5, RAVER2, RBBP4, RBBP5, RBM15, RBM34, RBM8A, RBMXL1, RCC1, RCOR3, RERE, RFWD2, RFX5, RGS13, RGS2, RHOC, RLF, RNASEL, RNF11, RNF187, RNF19B, RNF2, RNPC3, RORC, RP11-426L16.10, RPAP2, RPE65, RPL5, RPS27, RPS6KA1, RPS6KC1, RRAGC, RRP15, RSBN1, RSC1A1, RTCA, RUNX3, RUSC1, RWDD3, RXRG, RYR2, S100A1, S100A11, S100A12, S100A13, S100A16, S100A4, S100A5, S100A6, S100A7, S100A9, S100PBP, SAMD11, SAMD13, SARS, SCCPDH, SCNM1, SCYL3, SDF4, SDHB, SDHC, SELP, SERBP1, SESN2, SETDB1, SF3A3, SFN, SGIP1, SH3BGRL3, SIKE1, SKI, SLC16A1, SLC25A24, SLC25A33, SLC25A34, SLC25A44, SLC27A3, SLC2A1, SLC30A2, SLC30A7, SLC35A3, SLC35D1, SLC50A1, SLC6A17, SMAP2, SMCP, SMG5, SMG7, SMYD2, SMYD3, SNAPIN, SNIP1, SNRPE, SNX27, SOAT1, SORT1, SOX13, SPAG17, SPEN, SPOCD1, SPRTN, SRRM1, SRSF10, SRSF11, SRSF4, SSBP3, SSR2, SSU72, SSX2IP, STK40, STPG1, STRIP1, STX12, STX6, STXBP3, SUCO, SV2A, SYCP1, SYF2, SYPL2, SYT11, SYT2, SYTL1, SZT2, TACSTD2, TAF12, TAF13, TAF5L, TAL1, TARBP1, TARDBP, TARS2, TATDN3, TBX15, TBX19, TCEANC2, TDRKH, TESK2, TEX35, TFAP2E, TFB2M, TGFBR3, THEM4, THEM5, THEMIS2, THRAP3, TIMM17A, TMED5, TMEM50A, TMEM57, TMEM59, TMEM9, TNFRSF1B, TNNI3K, TNR, TOE1, TOMM20, TOMM40L, TOR1AIP2, TP53BP2, TP73, TPR, TPRG1L, TRAF3IP3, TRAPPC3, TRIM11, TRIM33, TRIM45, TRIM63, TRNAU1AP, TROVE2, TSNAX, TSTD1, TTF2, TXNIP, UAP1, UBE2J2, UBIAD1, UBQLN4, UBR4, UCHL5, UCK2, UHMK1, UQCRH, URB2, UROD, USF1, USP1, USP21, USP33, USP48, VAMP3, VAMP4, VCAM1, VHLL, VPS45, VPS72, WARS2, WASF2, WDR26, WDR3, WDR77, WDTC1, WLS, YARS, YBX1, YIPF1, YRDC, YY1AP1, ZBED6, ZBTB18, ZBTB37, ZBTB40, ZBTB41, ZBTB48, ZBTB7B, ZBTB8A, ZBTB8B, ZC3H12A, ZCCHC11, ZFP69, ZFP69B, ZFYVE9, ZMYM1, ZMYM6, ZNF124, ZNF281, ZNF326, ZNF362, ZNF496, ZNF644, ZNF648, ZNF669, ZNF670, ZNF672, ZNF678, ZNF683, ZNF684, ZNF691, ZNF692, ZNF695, ZNF697, ZRANB2, ZSCAN20"
Blood cell pcHi-C,Links w/ 5+ tissues vs Links w/ 1+ tissue,chr11,GO:0032991,CC,e,protein-containing complex    ,205/1003,216/1166,6.72e-06,1,205,0.0229,"ABCC8, ALX4, AMOTL1, ANAPC15, ANO1, AP2A2, AP5B1, API5, APOA1, APOA4, APOA5, APOC3, ARCN1, ARNTL, ARRB1, ATG13, ATP5L, BARX2, BBS1, BEST1, BET1L, BIRC2, BIRC3, BSX, BUD13, C1QTNF5, CASP1, CASP5, CBL, CCND1, CD3D, CD3E, CD3G, CDCA5, CELF1, CKAP5, CLCF1, CLP1, CNIH2, CNTF, COPB1, CPSF7, CTR9, CUL5, CWC15, DDB1, DDB2, DDX6, DEAF1, DIXDC1, DLAT, DNHD1, DYNC2H1, EED, EEF1G, EIF3F, EIF3M, EIF4G2, ELP4, ETS1, FADD, FAM160A2, FANCF, FAU, FOXR1, FTH1, FXYD2, GANAB, GLB1L2, GLB1L3, GNG3, GRIA4, GRIK4, GTF2H1, H2AFX, HBE1, HBG2, HPS5, HSPA8, IFT46, IGHMBP2, ILK, IMMP1L, INCENP, INTS4, INTS5, IPO7, KAT5, KCNC1, KCNJ1, KCNJ11, KCNJ5, KCNQ1, KIF18A, KLC2, KMT2A, LAMTOR1, LMO2, LRP5, MED17, MED19, MEN1, MRE11A, MRPL23, MS4A2, MTA2, MYO7A, MYOD1, NCAPD3, NDUFC2, NDUFS3, NDUFS8, NFRKB, NPAS4, NUP160, NUP98, NXF1, P4HA3, PAAF1, PAK1, PANX1, PATL1, PCF11, PDE3B, PDZD3, PHF21A, PICALM, PIK3C2A, PLCB3, POLA2, POLD3, POLR2G, POLR2L, PPP1CA, PPP2R5B, PRPF19, PRR5L, PSMA1, PSMC3, PSMD13, RAD9A, RBM14, RBMXL2, RCOR2, RELA, RNASEH2C, RNH1, RPL27A, RPLP2, RPS13, RPS25, RPS3, RRM1, RRP8, RSF1, SAA2, SAA4, SART1, SCN2B, SCN3B, SCN4B, SCYL1, SDHD, SF1, SF3B2, SHANK2, SIPA1, SLC22A6, SORL1, SPCS2, SPTBN2, SRPR, STIM1, STIP1, STT3A, STX3, STX5, TAF10, TAF1D, TAF6L, TIMM10, TIMM10B, TIMM8B, TMEM216, TNKS1BP1, TNNI2, TNNT3, TOLLIP, TRAF6, TRAPPC4, TRIM21, TRMT112, TSG101, TSPAN32, TUT1, UBE4A, UBXN1, USP28, USP47, UVRAG, VPS26B, VPS37C, VPS51, YAP1, ZBTB16"
Blood cell pcHi-C,Links w/ 5+ tissues vs Links w/ 1+ tissue,chr21,GO:0008150,BP,e,biological_process            ,123/152,141/199,7.9e-08,0,123,3.2e-05,"ABCG1, ADAMTS1, ADAMTS5, ADARB1, AGPAT3, AP000304.12, APP, ATP5J, ATP5O, BACE2, BACH1, BRWD1, BTG3, C21orf2, C21orf62, CBR3, CCT8, CHAF1B, CHODL, CLDN14, CLIC6, COL18A1, CRYAA, CRYZL1, CXADR, CYYR1, DIP2A, DNMT3L, DONSON, DOPEY2, DSCAM, DSCR3, DSCR8, DYRK1A, ERG, ETS2, FAM3B, GABPA, GART, GRIK1, HLCS, HMGN1, HSF2BP, HSPA13, HUNK, ICOSLG, IFNAR1, IFNAR2, IFNGR2, IL10RB, ITSN1, JAM2, KCNE1, KCNE2, KCNJ15, KCNJ6, LIPI, LSS, LTN1, MIS18A, MORC3, MRAP, MRPL39, MRPS6, MX1, MX2, N6AMT1, NCAM2, NDUFV3, NRIP1, OLIG1, PAXBP1, PCBP3, PCNT, PCP4, PDE9A, PDXK, PFKL, PIGP, POFUT2, PRDM15, PRMT2, PSMG1, PTTG1IP, PWP2, RBM11, RCAN1, RIPK4, RIPPLY3, RRP1, RRP1B, RUNX1, RWDD2B, S100B, SAMSN1, SH3BGR, SIK1, SIM2, SLC19A1, SLC37A1, SLC5A3, SMIM11, SOD1, SON, SUMO3, SYNJ1, TFF2, TFF3, TIAM1, TMEM50B, TMPRSS15, TMPRSS2, TRAPPC10, TSPEAR, TTC3, U2AF1, UBASH3A, UBE2G2, URB1, USP16, USP25, WDR4, ZBTB21"
Blood cell pcHi-C,Links w/ 5+ tissues vs Links w/ 1+ tissue,chr21,GO:0050789,BP,e,regulation of biological process,65/152,71/199,0.000111,2,65,0.0225,"ABCG1, ADAMTS1, ADARB1, APP, BACE2, BACH1, BRWD1, BTG3, C21orf2, CHAF1B, COL18A1, CRYAA, CXADR, DNMT3L, DSCAM, DYRK1A, ERG, ETS2, GABPA, GRIK1, HMGN1, HUNK, ICOSLG, IFNAR1, IFNAR2, IFNGR2, IL10RB, ITSN1, JAM2, KCNE1, KCNE2, MIS18A, MORC3, MX1, MX2, N6AMT1, NRIP1, OLIG1, PAXBP1, PCNT, PDE9A, PFKL, POFUT2, PRDM15, PRMT2, PWP2, RCAN1, RIPK4, RIPPLY3, RRP1B, RUNX1, S100B, SAMSN1, SIK1, SIM2, SLC5A3, SOD1, SON, SUMO3, TFF2, TIAM1, TTC3, UBASH3A, USP16, ZBTB21"
Blood cell pcHi-C,Links w/ 5+ tissues vs Links w/ 1+ tissue,chr21,GO:0009987,BP,e,cellular process              ,96/152,111/199,0.000202,1,96,0.0357,"ABCG1, ADAMTS1, ADARB1, AGPAT3, AP000304.12, APP, ATP5J, ATP5O, BACH1, BRWD1, C21orf2, CBR3, CCT8, CHAF1B, CLDN14, COL18A1, CRYAA, CRYZL1, CXADR, DNMT3L, DOPEY2, DSCAM, DSCR3, DYRK1A, ERG, ETS2, FAM3B, GABPA, GART, GRIK1, HLCS, HMGN1, HSF2BP, HUNK, ICOSLG, IFNAR1, IFNAR2, IFNGR2, IL10RB, ITSN1, JAM2, KCNE1, KCNE2, KCNJ15, KCNJ6, MIS18A, MORC3, MRAP, MRPS6, MX1, MX2, N6AMT1, NCAM2, NDUFV3, NRIP1, OLIG1, PAXBP1, PCBP3, PCNT, PDE9A, PDXK, PFKL, PIGP, PRDM15, PRMT2, PSMG1, PTTG1IP, PWP2, RBM11, RCAN1, RIPK4, RIPPLY3, RRP1, RRP1B, RUNX1, S100B, SH3BGR, SIK1, SIM2, SLC19A1, SLC37A1, SLC5A3, SOD1, SON, SUMO3, SYNJ1, TFF2, TIAM1, TRAPPC10, TTC3, U2AF1, UBE2G2, USP16, USP25, WDR4, ZBTB21"
Blood cell pcHi-C,Links w/ 5+ tissues vs Links w/ 1+ tissue,chr21,GO:0050794,BP,e,regulation of cellular process,63/152,69/199,0.000206,3,63,0.0357,"ABCG1, ADAMTS1, ADARB1, APP, BACE2, BACH1, BRWD1, BTG3, CHAF1B, COL18A1, CRYAA, CXADR, DNMT3L, DSCAM, DYRK1A, ERG, ETS2, GABPA, GRIK1, HMGN1, HUNK, ICOSLG, IFNAR1, IFNAR2, IFNGR2, IL10RB, ITSN1, JAM2, KCNE1, KCNE2, MIS18A, MORC3, MX1, MX2, N6AMT1, NRIP1, OLIG1, PAXBP1, PCNT, PDE9A, PFKL, POFUT2, PRDM15, PRMT2, PWP2, RCAN1, RIPK4, RIPPLY3, RRP1B, RUNX1, S100B, SAMSN1, SIK1, SIM2, SOD1, SON, SUMO3, TFF2, TIAM1, TTC3, UBASH3A, USP16, ZBTB21"
Blood cell pcHi-C,Links w/ 5+ tissues vs Links w/ 1+ tissue,chr21,GO:0043229,CC,e,intracellular organelle       ,89/152,101/199,9.84e-05,3,89,0.0218,"ABCG1, ADAMTS1, ADAMTS5, ADARB1, AGPAT3, APP, ATP5J, ATP5O, BACE2, BACH1, BRWD1, C21orf33, C21orf59, C21orf67, C2CD2, CBR3, CCT8, CHAF1B, CLDN14, CRYAA, CXADR, DIP2A, DNMT3L, DONSON, DSCR3, DYRK1A, ERG, ETS2, GABPA, HLCS, HMGN1, HSPA13, IFNGR2, ITSN1, KCNE1, KCNE2, KCNJ6, LSS, MAP3K7CL, MIS18A, MORC3, MRAP, MRPL39, MRPS6, MX1, MX2, NDUFV3, NRIP1, OLIG1, PAXBP1, PCBP3, PCNT, PCP4, PDE9A, PDXK, PIGP, POFUT2, PRDM15, PRMT2, PSMG1, PTTG1IP, PWP2, RCAN1, RIPK4, RIPPLY3, RRP1, RRP1B, RUNX1, S100B, SAMSN1, SIK1, SIM2, SOD1, SON, SUMO3, TCP10L, TFF3, TMEM50B, TRAPPC10, TTC3, U2AF1, UBASH3A, UBE2G2, URB1, USP16, USP25, WDR4, WRB, ZBTB21"
Blood cell pcHi-C,Links w/ 5+ tissues vs Links w/ 1+ tissue,chr21,GO:0043226,CC,e,organelle                     ,89/152,101/199,9.84e-05,2,89,0.0218,"ABCG1, ADAMTS1, ADAMTS5, ADARB1, AGPAT3, APP, ATP5J, ATP5O, BACE2, BACH1, BRWD1, C21orf33, C21orf59, C21orf67, C2CD2, CBR3, CCT8, CHAF1B, CLDN14, CRYAA, CXADR, DIP2A, DNMT3L, DONSON, DSCR3, DYRK1A, ERG, ETS2, GABPA, HLCS, HMGN1, HSPA13, IFNGR2, ITSN1, KCNE1, KCNE2, KCNJ6, LSS, MAP3K7CL, MIS18A, MORC3, MRAP, MRPL39, MRPS6, MX1, MX2, NDUFV3, NRIP1, OLIG1, PAXBP1, PCBP3, PCNT, PCP4, PDE9A, PDXK, PIGP, POFUT2, PRDM15, PRMT2, PSMG1, PTTG1IP, PWP2, RCAN1, RIPK4, RIPPLY3, RRP1, RRP1B, RUNX1, S100B, SAMSN1, SIK1, SIM2, SOD1, SON, SUMO3, TCP10L, TFF3, TMEM50B, TRAPPC10, TTC3, U2AF1, UBASH3A, UBE2G2, URB1, USP16, USP25, WDR4, WRB, ZBTB21"
Blood cell pcHi-C,Links w/ 5+ tissues vs Links w/ 1+ tissue,chr21,GO:0003674,MF,e,molecular_function            ,128/152,150/199,1.04e-06,0,128,0.000361,"ABCG1, ADAMTS1, ADAMTS5, ADARB1, AGPAT3, AP000295.9, AP000304.12, APP, ATP5J, ATP5O, BACE2, BACH1, BRWD1, BTG3, C21orf2, C21orf62, C2CD2, CBR3, CCT8, CHAF1B, CHODL, CLDN14, CLIC6, COL18A1, CRYAA, CRYZL1, CXADR, CYYR1, DIP2A, DNMT3L, DONSON, DOPEY2, DSCAM, DSCR3, DSCR8, DYRK1A, ERG, ETS2, EVA1C, FAM3B, GABPA, GART, GRIK1, HLCS, HMGN1, HSF2BP, HSPA13, HUNK, ICOSLG, IFNAR1, IFNAR2, IFNGR2, IL10RB, ITSN1, JAM2, KCNE1, KCNE2, KCNJ15, KCNJ6, LIPI, LSS, LTN1, MAP3K7CL, MIS18A, MORC3, MRAP, MRPL39, MRPS6, MX1, MX2, N6AMT1, NCAM2, NDUFV3, NRIP1, OLIG1, PAXBP1, PCBP3, PCNT, PCP4, PDE9A, PDXK, PFKL, PIGP, POFUT2, PRDM15, PRMT2, PSMG1, PTTG1IP, PWP2, RBM11, RCAN1, RIPK4, RIPPLY3, RRP1B, RUNX1, RWDD2B, S100B, SAMSN1, SETD4, SH3BGR, SIK1, SIM2, SLC19A1, SLC37A1, SLC5A3, SMIM11, SOD1, SON, SUMO3, SYNJ1, TFF2, TFF3, TIAM1, TMEM50B, TMPRSS15, TMPRSS2, TRAPPC10, TSPEAR, TTC3, U2AF1, UBASH3A, UBE2G2, UMODL1, URB1, USP16, USP25, WDR4, ZBTB21"
Blood cell pcHi-C,Links w/ 5+ tissues vs Links w/ 1+ tissue,chr21,GO:0005488,MF,e,binding                       ,105/152,121/199,2.97e-05,1,105,0.00902,"ABCG1, ADAMTS1, ADAMTS5, ADARB1, AP000295.9, APP, BACH1, BRWD1, BTG3, C2CD2, CBR3, CCT8, CHAF1B, CHODL, CLDN14, CLIC6, COL18A1, CRYAA, CRYZL1, CXADR, DIP2A, DNMT3L, DSCAM, DYRK1A, ERG, ETS2, EVA1C, FAM3B, GABPA, GART, GRIK1, HLCS, HMGN1, HSF2BP, HSPA13, HUNK, ICOSLG, IFNAR1, IFNAR2, IFNGR2, IL10RB, ITSN1, JAM2, KCNE1, KCNE2, KCNJ15, KCNJ6, LIPI, LTN1, MAP3K7CL, MIS18A, MORC3, MRAP, MRPL39, MRPS6, MX1, MX2, N6AMT1, NCAM2, NRIP1, OLIG1, PAXBP1, PCBP3, PCNT, PCP4, PDE9A, PDXK, PFKL, PRDM15, PRMT2, PSMG1, PWP2, RBM11, RCAN1, RIPK4, RIPPLY3, RRP1B, RUNX1, RWDD2B, S100B, SAMSN1, SETD4, SH3BGR, SIK1, SIM2, SLC19A1, SOD1, SON, SUMO3, SYNJ1, TFF2, TIAM1, TMPRSS15, TMPRSS2, TRAPPC10, TTC3, U2AF1, UBASH3A, UBE2G2, UMODL1, URB1, USP16, USP25, WDR4, ZBTB21"
Blood cell pcHi-C,Links w/ 5+ tissues vs Links w/ 1+ tissue,chr21,GO:0005515,MF,e,protein binding               ,89/152,101/199,9.84e-05,2,89,0.0218,"ABCG1, ADAMTS1, ADAMTS5, ADARB1, AP000295.9, APP, BACH1, BRWD1, BTG3, C2CD2, CCT8, CHAF1B, CLDN14, CLIC6, COL18A1, CRYAA, CXADR, DIP2A, DNMT3L, DSCAM, DYRK1A, ERG, ETS2, FAM3B, GABPA, GRIK1, HLCS, HSF2BP, ICOSLG, IFNAR1, IFNAR2, IFNGR2, IL10RB, ITSN1, JAM2, KCNE1, KCNE2, KCNJ15, KCNJ6, LTN1, MAP3K7CL, MIS18A, MRAP, MX1, MX2, N6AMT1, NCAM2, NRIP1, OLIG1, PAXBP1, PCNT, PCP4, PDE9A, PDXK, PFKL, PRDM15, PRMT2, PSMG1, PWP2, RCAN1, RIPK4, RIPPLY3, RRP1B, RUNX1, RWDD2B, S100B, SAMSN1, SETD4, SH3BGR, SIK1, SIM2, SOD1, SON, SUMO3, SYNJ1, TFF2, TIAM1, TMPRSS15, TMPRSS2, TRAPPC10, TTC3, U2AF1, UBASH3A, UBE2G2, UMODL1, USP16, USP25, WDR4, ZBTB21"
Randomized blood cell pcHi-C,Links w/ 5+ tissues vs Links w/ 1+ tissue,chr14,GO:0008150,BP,e,biological_process            ,446/541,475/596,1.9e-06,0,446,0.00272,"ABCD4, ABHD4, ACIN1, ACTN1, ACTR10, ACYP1, ADAM21, ADCK1, ADCY4, ADSSL1, AHSA1, AJUBA, AK7, AKAP5, AKAP6, AKT1, ALDH6A1, ALKBH1, AMN, ANG, AP1G2, AP4S1, AP5M1, APEX1, APOPT1, AREL1, ARF6, ARG2, ARHGAP5, ARHGEF40, ARID4A, ASB2, ASPG, ATG14, ATG2B, ATL1, ATP5S, ATP6V1D, ATXN3, BAG5, BATF, BAZ1A, BCL11B, BCL2L2, BCL2L2-PABPN1, BDKRB1, BDKRB2, BMP4, BRF1, BRMS1L, BTBD7, C14orf1, C14orf159, C14orf166, C14orf2, C14orf39, CALM1, CATSPERB, CCDC176, CCDC85C, CCDC88C, CCNB1IP1, CCNK, CDC42BPB, CDH24, CDKL1, CDKN3, CEBPE, CFL2, CGRRF1, CHD8, CHGA, CHMP4A, CHURC1, CHURC1-FNTB, CIDEB, CLMN, CMA1, CMTM5, CNIH1, COCH, COQ6, COX16, CPNE6, CPSF2, CRIP1, CRIP2, CTAGE5, CTSG, CYP46A1, DAAM1, DACT1, DAD1, DCAF11, DCAF4, DCAF5, DDHD1, DDX24, DEGS2, DHRS1, DHRS7, DICER1, DIO2, DIO3, DLGAP5, DLK1, DLST, DNAAF2, DPF3, DTD2, DYNC1H1, EAPP, EDDM3A, EDDM3B, EGLN3, EIF2B2, EIF2S1, EIF5, ELMSAN1, ENTPD5, ERH, ERO1L, ESR2, EVL, EXD2, EXOC5, FANCM, FBLN5, FBXO33, FCF1, FITM1, FKBP3, FLRT2, FLVCR2, FNTB, FOS, FOXA1, FOXG1, FOXN3, FRMD6, FUT8, G2E3, GALC, GALNT16, GCH1, GEMIN2, GLRX5, GMFB, GMPR2, GNG2, GNPNAT1, GOLGA5, GPHN, GPR132, GPR135, GPR65, GPR68, GPX2, GSTZ1, GTF2A1, GZMB, GZMH, HAUS4, HECTD1, HHIPL1, HIF1A, HNRNPC, HOMEZ, HSP90AA1, HSPA2, IFI27, IFT43, IL25, INF2, INSM2, IPO4, IRF2BPL, IRF9, ISCA2, ITPK1, JAG2, JDP2, JKAMP, JPH4, KCNH5, KCNK10, KCNK13, KHNYN, KIAA0247, KIAA0391, KIAA0586, KIF26A, KLC1, KTN1, L2HGDH, L3HYPDH, LGMN, LIN52, LRP10, LRR1, LTB4R, LTB4R2, LTBP2, MAP3K9, MAP4K5, MAX, MBIP, MED6, METTL17, METTL3, MGAT2, MIA2, MIS18BP1, MLH3, MMP14, MNAT1, MOAP1, MOK, MPP5, MRPL52, MTA1, MTHFD1, MYH6, MYH7, NDRG2, NDUFB1, NEDD8, NEDD8-MDP1, NEK9, NEMF, NFATC4, NFKBIA, NGDN, NID2, NIN, NKX2-8, NOP9, NOXRED1, NPAS3, NPC2, NRDE2, NRL, NRXN3, NUBPL, NUMB, NYNRIN, OR10G2, OR11G2, OR11H4, OR11H6, OR4E2, OR4K1, OR4K13, OR4K14, OR4K17, OR4K2, OR4K5, OR4L1, OR4N2, OR4N5, OR4Q3, OR5AU1, OR6J1, OR6S1, OSGEP, OTUB2, OTX2, OXA1L, PACS2, PAPOLA, PARP2, PAX9, PCK2, PELI2, PGF, PIGH, PLD4, PLEK2, PLEKHG3, PNMA1, PNN, PNP, POLE2, POMT2, PPM1A, PPP1R13B, PPP1R3E, PPP2R3C, PPP2R5C, PPP2R5E, PPP4R4, PRIMA1, PRKCH, PRKD1, PRMT5, PROX2, PRPF39, PSEN1, PSMA3, PSMA6, PSMB11, PSMB5, PSMC1, PSMC6, PSME1, PSME2, PTGDR, PTGER2, PTGR2, PTPN21, PYGL, RAB2B, RABGGTA, RAD51B, RALGAPA1, RBM23, RBM25, RCOR1, RDH11, RDH12, REC8, REM2, RGS6, RIN3, RIPK3, RNASE10, RNASE2, RNASE3, RNASE4, RNASE6, RNASE7, RNF31, RP11-1012A1.4, RP11-176H8.1, RP11-47I22.4, RP11-73M18.2, RPGRIP1, RPL10L, RPL36AL, RPS29, RPS6KA5, RPS6KL1, RTL1, RTN1, SALL2, SAMD4A, SCFD1, SDR39U1, SEC23A, SEL1L, SERPINA1, SERPINA12, SERPINA9, SETD3, SGPP1, SIPA1L1, SIVA1, SIX1, SIX4, SIX6, SLC10A1, SLC22A17, SLC24A4, SLC25A21, SLC25A29, SLC25A47, SLC38A6, SLC39A2, SLC39A9, SLC7A7, SLC7A8, SLC8A3, SLIRP, SMEK1, SMOC1, SNAPC1, SNW1, SNX6, SOCS4, SOS2, SPATA7, SPTB, SPTLC2, SPTSSA, SRP54, SRSF5, SSTR1, STON2, STRN3, STXBP6, STYX, SUPT16H, SYNE2, SYNE3, SYNJ2BP, TBPL2, TDP1, TDRD9, TEP1, TGFB3, TGM1, THTPA, TIMM9, TINF2, TM9SF1, TMED10, TMED8, TMEM121, TMEM30B, TMX1, TNFAIP2, TOMM20L, TRAF3, TRAPPC6B, TRIP11, TRMT61A, TSHR, TSSK4, TTC5, TTC8, TTLL5, TXNDC16, UBR7, UNC79, VASH1, VCPKMT, VIPAS39, VRK1, VRTN, VSX2, VTI1B, WARS, WDHD1, XRCC3, YLPM1, YY1, ZBTB1, ZBTB25, ZBTB42, ZDHHC22, ZFHX2, ZFP36L1, ZFYVE1, ZFYVE26, ZNF219, ZNF410"
